"Rice Lake Ready-n-Weigh CW-90B-380-25 Bench Scale, 12"" x 12"", 25 lb x 0.005 lb, NTEP Class III",https://cdn11.bigcommerce.com/s-errhy7umuu/images/stencil/1280x1280/products/13690/52252/rice-lake-weighing-systems-rice-lake-ready-n-weigh-bench-scale-cw-90b-380-25-12-x-12-25-lb-x-0.005-lb-ntep-class-iii__44001.1701107407.jpg?c=2,https://cdn11.bigcommerce.com/s-errhy7umuu/images/stencil/1280x1280/products/13690/52352/rice-lake-weighing-systems-rice-lake-ready-n-weigh-bench-scale-cw-90b-380-25-12-x-12-25-lb-x-0.005-lb-ntep-class-iii__55771.1701107407.jpg?c=2,"$1,480.00","$1,406.00",$74.00,None,"NIST Traceable Calibration, $129.00","ISO 17025:2017 Accredited Calibration, $199.00","This Rice Lake Ready-n-Weigh Bench Scale features the CW-90B Scale Base and 380 Indicator. The CW-90B Scale Base provides a robust platform with its durable construction and extensive overload protection, ensuring reliable performance even in demanding environments. Coupled with the 380 Indicator, this system offers precise measurements, easy-to-read display, and user-friendly operation. With its convenient battery power, the Rice Lake Ready-n-Weigh CW-90B-380 offers a high quality portable weighing solution. The unit is also NTEP approved for use in legal for trade applications. ",,,,,,,,,,,,,https://store-errhy7umuu.mybigcommerce.com/content/Rice%20Lake%20Manuals/Bench%20Scales/380%20and%20CW-90B%20base.pdf,https://store-errhy7umuu.mybigcommerce.com/content/Rice%20Lake%20Manuals/Indicators/380/2021_cat_indicators_380.pdf,2 year manufacturer's warranty,25 lb,0.005 lb,,,"12"" x 12""",,,"LCD display, six-digits, 1"" tall",,Batteries: 4 Alkaline C-cell (Optional: 115/230VAC to 12VDC adapter),,Rice Lake Weighing Systems,CW-90B-380-25,https://www.scalesplus.com/rice-lake-ready-n-weigh-cw-90b-380-25-bench-scale-12-x-12/,https://cdn11.bigcommerce.com/s-errhy7umuu/images/stencil/1280x1280/products/13690/52295/rice-lake-weighing-systems-rice-lake-ready-n-weigh-bench-scale-cw-90b-380-25-12-x-12-25-lb-x-0.005-lb-ntep-class-iii__96715.1701107407.jpg?c=2,https://cdn11.bigcommerce.com/s-errhy7umuu/images/stencil/1280x1280/products/13690/52320/rice-lake-weighing-systems-rice-lake-ready-n-weigh-bench-scale-cw-90b-380-25-12-x-12-25-lb-x-0.005-lb-ntep-class-iii__67214.1701107407.jpg?c=2,,,,,,General Weighing,,,https://store-errhy7umuu.mybigcommerce.com/content/Rice%20Lake%20Manuals/Indicators/380/m_201481_380tech_enus_reva.pdf,Yes,III,,,,,,304 stainless steel,,,,,,,,,,,,,,,,,,,,,,,,,,,,,,,,,,,,,,,,,,,,,,,,,,,,,,,,,,,,,,,,,,,,,,,,,,,,,,,,,,,,,,,,,,21-051,95-072,,,,,,,,,,,,,,,,,,,,,,,,,,,,,,,,,,,,,,,,,,,,,,,,±0.01% full scale,,"g, lb, t, tn, kg, oz, battery level, PT, LT, gross, zero, unstable, net",,,,,,,,,,"12"" x 12"" base",IP67 rated load cell,304 stainless steel construction,Five point overload protection with up to 180% to 200% overload rating,Four adjusted rubber feet for leveling,NTEP and Measurement Canada approved,"Battery powered via four C-cell batteries, Optional AC adapter (PN:206433)",Easy installation and removal of batteries through two battery packs accessed through the bottom of the indicator,304 stainless steel enclosure with IP66 rating overall,Simplified 5-button operation,Three wire RS-232 and USB 2.0 communication capable,"LCD display, six 1"" digits",Full front-panel digital calibration,"Capable of printing, Optional Date and Time can be added with module (PN:204258)",Push button and keyed tare,NTEP and Measurement Canada approved,IP67,IP66,5 membrane tactile keys,RS-232 (3 wire) or USB,"g, lb, t, tn, kg, oz",5 VDC,14°F to 104°F,,,,,,,,,,,,,,,,,,,,,,,,,,,,,,,,,,,,,,,,,,,,,,,,,,,,,,,,,,,,,,,,,,,,,,,,,,,,,,,,,,,,,,,,,,,,,,,,,,,,,,,,,,,,
"Rice Lake Ready-n-Weigh CW-90B-380-10 Bench Scale, 10"" x 10"", 10 lb x 0.002 lb, NTEP Class III",https://cdn11.bigcommerce.com/s-errhy7umuu/images/stencil/1280x1280/products/13688/52247/rice-lake-weighing-systems-rice-lake-ready-n-weigh-bench-scale-cw-90b-380-10-10-x-10-10-lb-x-0.002-lb-ntep-class-iii__21577.1701107406.jpg?c=2,https://cdn11.bigcommerce.com/s-errhy7umuu/images/stencil/1280x1280/products/13688/52263/rice-lake-weighing-systems-rice-lake-ready-n-weigh-bench-scale-cw-90b-380-10-10-x-10-10-lb-x-0.002-lb-ntep-class-iii__66879.1701107406.jpg?c=2,"$1,390.00","$1,321.00",$69.00,None,"NIST Traceable Calibration, $129.00","ISO 17025:2017 Accredited Calibration, $199.00","This Rice Lake Ready-n-Weigh Bench Scale features the CW-90B Scale Base and 380 Indicator. The CW-90B Scale Base provides a robust platform with its durable construction and extensive overload protection, ensuring reliable performance even in demanding environments. Coupled with the 380 Indicator, this system offers precise measurements, easy-to-read display, and user-friendly operation. With its convenient battery power, the Rice Lake Ready-n-Weigh CW-90B-380 offers a high quality portable weighing solution. The unit is also NTEP approved for use in legal for trade applications. ",,,,,,,,,,,,,https://store-errhy7umuu.mybigcommerce.com/content/Rice%20Lake%20Manuals/Bench%20Scales/380%20and%20CW-90B%20base.pdf,https://store-errhy7umuu.mybigcommerce.com/content/Rice%20Lake%20Manuals/Indicators/380/2021_cat_indicators_380.pdf,2 year manufacturer's warranty,10 lb,0.002 lb,,,"10"" x 10""",,,"LCD display, six-digits, 1"" tall",,Batteries: 4 Alkaline C-cell (Optional: 115/230VAC to 12VDC adapter),,Rice Lake Weighing Systems,CW-90B-380-10,https://www.scalesplus.com/rice-lake-ready-n-weigh-cw-90b-380-10-bench-scale-10-x-10/,https://cdn11.bigcommerce.com/s-errhy7umuu/images/stencil/1280x1280/products/13688/52241/rice-lake-weighing-systems-rice-lake-ready-n-weigh-bench-scale-cw-90b-380-10-10-x-10-10-lb-x-0.002-lb-ntep-class-iii__66419.1701107406.jpg?c=2,https://cdn11.bigcommerce.com/s-errhy7umuu/images/stencil/1280x1280/products/13688/52294/rice-lake-weighing-systems-rice-lake-ready-n-weigh-bench-scale-cw-90b-380-10-10-x-10-10-lb-x-0.002-lb-ntep-class-iii__28915.1701107406.jpg?c=2,,,,,,General Weighing,,,https://store-errhy7umuu.mybigcommerce.com/content/Rice%20Lake%20Manuals/Indicators/380/m_201481_380tech_enus_reva.pdf,Yes,III,,,,,,304 stainless steel,,,,,,,,,,,,,,,,,,,,,,,,,,,,,,,,,,,,,,,,,,,,,,,,,,,,,,,,,,,,,,,,,,,,,,,,,,,,,,,,,,,,,,,,,,21-051,95-072,,,,,,,,,,,,,,,,,,,,,,,,,,,,,,,,,,,,,,,,,,,,,,,,±0.01% full scale,,"g, lb, t, tn, kg, oz, battery level, PT, LT, gross, zero, unstable, net",,,,,,,,,,,,,,,,"Battery powered via four C-cell batteries, Optional AC adapter (PN:206433)",Easy installation and removal of batteries through two battery packs accessed through the bottom of the indicator,304 stainless steel enclosure with IP66 rating overall,Simplified 5-button operation,Three wire RS-232 and USB 2.0 communication capable,"LCD display, six 1"" digits",Full front-panel digital calibration,"Capable of printing, Optional Date and Time can be added with module (PN:204258)",Push button and keyed tare,NTEP and Measurement Canada approved,IP67,IP66,5 membrane tactile keys,RS-232 (3 wire) or USB,"g, lb, t, tn, kg, oz",5 VDC,14°F to 104°F,"10"" x 10"" base",IP67 rated load cell,304 stainless steel construction,Five point overload protection with up to 180% to 200% overload rating,Four adjusted rubber feet for leveling,NTEP and Measurement Canada approved,,,,,,,,,,,,,,,,,,,,,,,,,,,,,,,,,,,,,,,,,,,,,,,,,,,,,,,,,,,,,,,,,,,,,,,,,,,,,,,,,,,,,,,,,,,,,,,,,,,,,,
"Rice Lake CW-90X Checkweighing Scale, 10 lb x 0.002 lb, 10"" x 10"" base, 115 V, NTEP, Class III",https://cdn11.bigcommerce.com/s-errhy7umuu/images/stencil/1280x1280/products/1243/45990/rice-lake-weighing-systems-rice-lake-cw-90x-checkweighing-scale-10-lb-x-0.002-lb-10-x-10-base-115-v-ntep-class-iii__76119.1665793996.jpg?c=2,https://cdn11.bigcommerce.com/s-errhy7umuu/images/stencil/1280x1280/products/1243/46626/rice-lake-weighing-systems-rice-lake-cw-90x-checkweighing-scale-10-lb-x-0.002-lb-10-x-10-base-115-v-ntep-class-iii__24460.1665794989.jpg?c=2,"$2,197.00","$2,087.00",$110.00,None,"NIST Traceable Calibration, $129.00","ISO 17025:2017 Accredited Calibration, $199.00","The Rice Lake CW-90X bench scale is built for checkweighing in heavy washdown environments. The digital indicator features a red LED weight display and a rigid piezo keypad which is one of the most durable keypads found on any weighing device. Its piezo keypad can withstand contact from knives and is resistant to liquids and other contaminants. The CW-90X bench scale is constructed of 304 stainless steel and has an IP69K rating for both the indicator and the load cell which means it is very well protected from water damage. The scale base also features shock absorbing technology with maximum overload protection of 200%. The setup menu is accessible through the front panel for easy configuration and can be password protected to control access. Setpoint values for over, under, and accept are easy to configure and a highly visible color coded light bar shows what the current status of the sample is. It offers three different types of checkweighing: range mode, target weight mode, and target percent mode. In addition, up to 50 unique ID's can be stored on the indicator for easy recall.  For communication with peripheral devices the CW-90X comes standard with 2 full duplex RS-232 serial ports. Optional upgrades for communication include ethernet, USB or fiber optic. The four standard digital I/O's can be configured to perform keyed functions remotely or to control external devices.  ","Checkweighing with color indication for below, accept, and over","Piezo keypad containing zero, units, print, tare, over, under, ID, target, enter, menu, power","Highly visible red LED display, 0.8 in, 6 digit, 14 segment",IP69K rated indicator and load cell,Hermetically sealed stainless steel loadcell,Shock protection,200% maximum overload,PreVent breather vent,"Multiple unit options, lb, kg, g, oz, lb-oz",Battery backed date and time,Memory for up to 50 IDs,,,,3 year manufacturer's limited warranty,10 lb,0.002 lb,,,,IP69K,,"Red LED display, 0.8"" (20mm), six-digit, 14-segment",,115 VAC 50/60 Hz,,Rice Lake Weighing Systems,CW-90X Bench Scale,https://www.scalesplus.com/rice-lake-cw-90x-bench-scale-105965/,https://cdn11.bigcommerce.com/s-errhy7umuu/images/stencil/1280x1280/products/1243/45849/rice-lake-weighing-systems-rice-lake-cw-90x-checkweighing-scale-10-lb-x-0.002-lb-10-x-10-base-115-v-ntep-class-iii__39639.1665793762.jpg?c=2,https://cdn11.bigcommerce.com/s-errhy7umuu/images/stencil/1280x1280/products/1243/45730/rice-lake-weighing-systems-rice-lake-cw-90x-checkweighing-scale-10-lb-x-0.002-lb-10-x-10-base-115-v-ntep-class-iii__34547.1665793553.jpg?c=2,,Configurable print formats,2 Standard RS-232 serial ports,4 configurable digital I/Os,Audit trail tracking,,,,,,,,,,,"lb, kg, g, oz, lb-oz",,,,,,,,,,,,,,,,,,,,,,,,,,,,,The Rice Lake CW-90X bench scale is NTEP approved and can be used in Legal for Trade weighing applications. The CW-90X bench scale conforms to NSF/ANSI Standard 169 making it ideal for food processing applications.,"Optional communication boards for Ethernet, USB or fiber-optic","Comes with 12"" stainless steel indicator column",,,,,,,,,,,,,,,,www.youtube.com/embed/TaeJNNNHqNk,,,,,,,"1:100,000","1:5,000",,,,,,,,,,,,"12""",Approximately 29 lb,General Weighing,Checkweighing,,,,,,,,,,,,,,CW-90X: NTEP CC 08-092,"Class III/IIIL 10,000d",Measurement Canada AM-5710,OIML R76/2006-GBI-10.02,EU Test Certificate GB-1385,UL/cUL Listed,,,,,,,,,,,, ,,,,,,,,,,,,,,,,,,,,,,,,,,,,,,"Rice Lake CW-90X Checkweighing Bench Scale, 10 lb x 0.002 lb, 10"" x 10"" Base, 115 V",CE marked,Scale base: NTEP CC 95-072,"Class III 5,000 d",Measurement Canada AM-5082,"Class III 5,000 d",NSF,"08-092 Class III/IIIL 10,000 d","95-072, Class III 5,000 d",Within 0.01 % of full scale,"zero, units, print, tare, over, under, ID, target, clear, decimal, enter, menu, power,","Under, Accept, Over, Percent, kg, g, lb, oz, center of zero, G/B, N, T, PT, neg, motion","960, 480, 240, 120, 60, 30, 15, 7.5 per second",Four channels on CPU board,4X,14 °F to 104 °F / -10 °C to 40 °C,1.5 A @ 115 VAC (8 W),"RFI, EMI, ESD protection","9.5"" x 6"" x 3.12""","10"" x 10"" x 4.25""",105965,,,,,,,,,,,,,,,,,,,,,,,,,,,,,,,,,,,,,,,,,,,,,,,,,,,,,,,,,,,,,,,,,,,,,,,,,,,,,,,,,,,,,,,,,,,,,,,,,,,,,,,,,,,,,,,,,,,,,,,,,,,,,,,,,,,
"OHAUS Valor 7000 V71P15T Bench Food Scale, 30 lb x 0.001 lb, NTEP",https://cdn11.bigcommerce.com/s-errhy7umuu/images/stencil/1280x1280/products/524/49643/ohaus-valor-7000-v71p15t-bench-food-scale-30-lb-x-.001-lb-ntep-class-iii__99527.1727126766.jpg?c=2,https://cdn11.bigcommerce.com/s-errhy7umuu/images/stencil/1280x1280/products/524/49872/ohaus-valor-7000-v71p15t-bench-food-scale-30-lb-x-.001-lb-ntep-class-iii__67869.1727126768.jpg?c=2,$899.00,$764.15,$134.85,None,"NIST Traceable Calibration, $129.00","ISO 17025:2017 Accredited Calibration, $199.00","The OHAUS Valor 7000 compact food scale is the best in its class and one of the newest lines of durable scales from OHAUS.  With large dual displays, touchless sensors, and a user friendly menu and setup, the OHAUS Valor 7000 will help increase your team's food weighing and processing productivity.  The infrared sensors help reduce the risk of cross-contamination of foods as  they allow operators to perform certain functions without touching the scale or any buttons.  The large backlit displays allow two operators to work on a scale at one time or for retail use and also have checkweighing LED indicators show operators if a the weight on the platform is over, under, or within target range. Increase throughput with the Valor 7000's rapid stabilization of one second along with precise results you expect from OHAUS. Connectivity includes the standard RS232 along with optional Ethernet, second RS232 or USB connections which allow connection to multiple peripherals in your process. Take the Valor 7000 wherever duty calls with its powerful lead acid battery that provides up to 210 hours between charges.",NTEP Legal for Trade certified,NTEP CC: 13-022A1,Meets or exceeds the NIST Handbook 44 Class III accuracy requirements,Meets or exceeds Canada's Weights and Measures Regulations,USDA-AMS accepted,NSF Certified,Supports HACCP certified systems,Durable ABS plastic housing,Stainless steel platform,Large dual displays,"Touchless infrared sensors for taring, zeroing, or printing",,,,1 year manufacturer's warranty,30 lb,0.001 lb,,,,,,,,"100-240 VAC / 50-60 Hz internal universal power supply, internal rechargeable lead acid battery",,OHAUS,V71P15T,https://www.scalesplus.com/ohaus-valor-7000-v71p15t-bench-food-scale-ntep/,https://cdn11.bigcommerce.com/s-errhy7umuu/images/stencil/1280x1280/products/524/49269/ohaus-valor-7000-v71p15t-bench-food-scale-30-lb-x-.001-lb-ntep-class-iii__36741.1727126769.jpg?c=2,https://cdn11.bigcommerce.com/s-errhy7umuu/images/stencil/1280x1280/products/524/48010/ohaus-valor-7000-v71p15t-bench-food-scale-30-lb-x-.001-lb-ntep-class-iii__48245.1727126770.jpg?c=2,https://cdn11.bigcommerce.com/s-errhy7umuu/images/stencil/1280x1280/products/524/49341/ohaus-valor-7000-v71p15t-bench-food-scale-30-lb-x-.001-lb-ntep-class-iii__51665.1727126771.jpg?c=2,1 second stabilization time,Standard RS232 port,"Optional Ethernet, second RS232, or USB",Compact design,Weighing,Percentage weighing,Check weighing or % check,,Yes,III,,,,11.8 x 8.9 in. / 300 x 225 mm,"kg, g, lb, oz, lb:oz","stainless steel platform, ABS Plastic housing","External, with user-selectable calibration weight value",,"Built-in RS232, optional 2nd RS232, USB, Ethernet",,,,,,,,,,,,12.2 x 12.9 x 4.6 in. / 311 x 327 x 117 mm,210 hours continuous use between recharges with 12 hour recharge time,,,,,,,,,,,,The OHAUS Valor 7000 is NTEP approved and meets or exceed the Class III accuracy requirements in accordance with NIST Handbook 44 and Canda's Weights and Measures Regulation.,Leveling bubble,Stability indicator,Carrying handle,,,Accumulation,,,,,,,,,,,,,,,,,,,,,,,,,,,,,,,,,,,,1 second,,,,,"NTEP certified, Measurement Canada approved",,https://cdn11.bigcommerce.com/s-errhy7umuu/images/stencil/1280x1280/products/524/49216/ohaus-valor-7000-v71p15t-bench-food-scale-30-lb-x-.001-lb-ntep-class-iii__72067.1727126773.jpg?c=2,https://cdn11.bigcommerce.com/s-errhy7umuu/images/stencil/1280x1280/products/524/48443/ohaus-valor-7000-v71p15t-bench-food-scale-30-lb-x-.001-lb-ntep-class-iii__49105.1727126775.jpg?c=2,Mechanical keys,Removable stainless steel platform,Spring-loaded power connector cover,Non-slip leveling feet,"Metrology: NIST Handbook 44 (NTEP CC 13-022) and Measurement Canada Weights and Measures Regulations (AM-5907C), OIML R76-1 (R76/2006-NL1-12-46), (Class III, nmax 3000)","Product Safety: CSA-C22.2 61010-1, UL 61010-1",Electromagnetic Compatibility: FCC Part 15; Industry Canada ICES-003 – Class B,Food Safety: NSF/ANSI 169-2009; NSF/ANSI /3-A 14159-1-2010,,,0.01 lb,,,,,,,,,,https://cdn11.bigcommerce.com/s-errhy7umuu/images/stencil/1280x1280/products/524/49664/ohaus-valor-7000-v71p15t-bench-food-scale-30-lb-x-.001-lb-ntep-class-iii__83535.1727126776.jpg?c=2,,Menu lockswitch,Selectable environmental and auto-print settings,,,,,,,,,,,https://cdn11.bigcommerce.com/s-errhy7umuu/images/stencil/1280x1280/products/524/48079/ohaus-valor-7000-v71p15t-bench-food-scale-30-lb-x-.001-lb-ntep-class-iii__94637.1727126777.jpg?c=2,https://cdn11.bigcommerce.com/s-errhy7umuu/images/stencil/1280x1280/products/524/47497/ohaus-valor-7000-v71p15t-bench-food-scale-30-lb-x-.001-lb-ntep-class-iii__33055.1727126779.jpg?c=2,Overload and underload indicators,Ideal as a food portioning scale,Rechargeable battery,210 hour battery life,Low battery indicator,Auto shut-off,Auto tare,Easy to clean and transport,Statistics printer ready,"kg, g, lb, oz","1.5 in / 40 mm high LCD display with white backlight, 6-digit, 7-segment","1 in / 26 mm high LCD display with white backlight, 6-digit, 7-segment",2% or 10% of full scale capacity,Full capacity by subtraction,150% of capacity,,,,,,,,,,,,,,,,,,,,,,,,,,,,,,,,,,,,,,,,,,,,,,,,,,,,,,,,,,,,,,,,,,,,,,,,,,,,,,,,,,,,,,,,,,,,,,,,,,,,,,,,,,,,,,,,,,,,,,,,,,,,,,,,,,,,,,,,,,,,,,,,,,,,,,,,
"Rice Lake CW-90X Checkweighing Scale, 25 lb x 0.005 lb, 12"" x 12"" Base, 115V,  NTEP, Class III",https://cdn11.bigcommerce.com/s-errhy7umuu/images/stencil/1280x1280/products/1245/45266/rice-lake-weighing-systems-rice-lake-cw-90x-checkweighing-scale-25-lb-x-0.005-lb-12-x-12-base-115v-ntep-class-iii__91070.1665792828.jpg?c=2,https://cdn11.bigcommerce.com/s-errhy7umuu/images/stencil/1280x1280/products/1245/45534/rice-lake-weighing-systems-rice-lake-cw-90x-checkweighing-scale-25-lb-x-0.005-lb-12-x-12-base-115v-ntep-class-iii__92274.1665793271.jpg?c=2,"$2,287.00","$2,173.00",$114.00,None,"NIST Traceable Calibration, $129.00","ISO 17025:2017 Accredited Calibration, $199.00","The Rice Lake CW-90X bench scale is built for checkweighing in heavy washdown environments. The digital indicator features a red LED weight display and a rigid piezo keypad which is one of the most durable keypads found on any weighing device. Its piezo keypad can withstand contact from knives and is resistant to liquids and other contaminants. The CW-90X bench scale is constructed of 304 stainless steel and has an IP69K rating for both the indicator and the load cell which means it is very well protected from water damage. The scale base also features shock absorbing technology with maximum overload protection of 150%. The setup menu is accessible through the front panel for easy configuration and can be password protected to control access. Setpoint values for over, under, and accept are easy to configure and a highly visible color coded light bar shows what the current status of the sample is. It offers three different types of checkweighing: range mode, target weight mode, and target percent mode. In addition, up to 50 unique ID's can be stored on the indicator for easy recall.  For communication with peripheral devices the CW-90X comes standard with 2 full duplex RS-232 serial ports. Optional upgrades for communication include ethernet, USB or fiber optic. The four standard digital I/O's can be configured to perform keyed functions remotely or to control external devices.  ","Checkweighing with color indication for below, accept, and over","Piezo keypad containing zero, units, print, tare, over, under, ID, target, enter, menu, power","Highly visible red LED display, 0.8 in, 6 digit, 14 segment",IP69K rated indicator and load cell,Hermetically sealed stainless steel loadcell,Shock protection,150% maximum overload,PreVent™ breather vent,"Multiple unit options, lb, kg, g, oz, lb-oz",Battery backed date and time,Memory for up to 50 IDs,,,,3 year manufacturer's limited warranty,25 lb,0.005 lb,,,,IP69K,,"Red LED display, 0.8"" (20mm), six-digit, 14-segment",,115 VAC 50/60 Hz,,Rice Lake Weighing Systems,CW-90X Bench Scale,https://www.scalesplus.com/rice-lake-cw-90x-bench-scale-105967,https://cdn11.bigcommerce.com/s-errhy7umuu/images/stencil/1280x1280/products/1245/46073/rice-lake-weighing-systems-rice-lake-cw-90x-checkweighing-scale-25-lb-x-0.005-lb-12-x-12-base-115v-ntep-class-iii__49644.1665794167.jpg?c=2,https://cdn11.bigcommerce.com/s-errhy7umuu/images/stencil/1280x1280/products/1245/46206/rice-lake-weighing-systems-rice-lake-cw-90x-checkweighing-scale-25-lb-x-0.005-lb-12-x-12-base-115v-ntep-class-iii__29119.1665794390.jpg?c=2,,Configurable print formats,2 Standard RS-232 serial ports,4 configurable digital I/Os,Audit trail tracking,,,,,,,,,,,"lb, kg, g, oz, lb-oz",,,,,,,,,,,,,,,,,,,,,,,,,,,,,The Rice Lake CW-90X bench scale is NTEP approved and can be used in Legal for Trade weighing applications. The CW-90X bench scale conforms to NSF/ANSI Standard 169 making it ideal for food processing applications.,"Optional communication boards for Ethernet, USB or fiber-optic","Comes with 12"" stainless steel indicator column",,,,,,,,,,,,,,,,www.youtube.com/embed/TaeJNNNHqNk,,,,,,,"1:100,000","1:5,000",,,,,,,,,,,,"12""",33 lb,General Weighing,Checkweighing,,,,,,,,,,,,,,CW-90X: NTEP CC 08-092,"Class III/IIIL 10,000d",Measurement Canada AM-5710,OIML R76/2006-GBI-10.02,EU Test Certificate GB-1385,UL/cUL Listed,,,,,,,,,,,, ,,,,,,,,,,,,,,,,,,,,,,,,,,,,,,"Rice Lake CW-90X Checkweighing Scale, 25 lb x 0.005 lb, 12"" x 12"" Base, 115V",CE marked,Scale base: NTEP CC 95-072,"Class III 5,000 d",Measurement Canada AM-5082,"Class III 5,000 d",NSF,"08-092 Class III/IIIL 10,000 d","95-072, Class III 5,000 d",Within 0.01 % of full scale,"zero, units, print, tare, over, under, ID, target, clear, decimal, enter, menu, power,","Under, Accept, Over, Percent, kg, g, lb, oz, center of zero, G/B, N, T, PT, neg, motion","960, 480, 240, 120, 60, 30, 15, 7.5 per second",Four channels on CPU board,4X,14°F to 104°F / -10°C to 40°C,1.5A @ 115V (8 W),"RFI, EMI, ESD protection","9.5"" x 6"" x 3.12""","12"" x 12"" x 4.25""",105967,,,,,,,,,,,,,,,,,,,,,,,,,,,,,,,,,,,,,,,,,,,,,,,,,,,,,,,,,,,,,,,,,,,,,,,,,,,,,,,,,,,,,,,,,,,,,,,,,,,,,,,,,,,,,,,,,,,,,,,,,,,,,,,,,,,
