"A&D Weighing SJ-15KWP Washdown Bench Scale, 15 kg x 0.5 g, NSF, NTEP",https://cdn11.bigcommerce.com/s-errhy7umuu/images/stencil/1280x1280/products/6935/39982/aandd-weighing-sj-15kwp-washdown-bench-scale-15-kg-x-0.5-g__25694.1721239387.jpg?c=2,https://cdn11.bigcommerce.com/s-errhy7umuu/images/stencil/1280x1280/products/6935/62703/aandd-weighing-sj-15kwp-washdown-bench-scale-15-kg-x-0.5-g-nsf-ntep__98806.1721949159.jpg?c=2,$590.00,$446.04,$143.96,None,"NIST Traceable Calibration, $129.00","ISO 17025:2017 Accredited Calibration, $199.00","A&D Weighing SJ Washdown Scales are ideal for a fast-paced industrial food packing and processing applications. They feature IP67 rated dust and waterproof protection, capable of handling the harshest environments without sacrificing reliable weighing results. The innovative 5-step light system ensures fast and accurate checkweighing processes. Checkweighing reduces the chances of overfilling or underfilling packages. Take-Away Check Weighing automatically performs tare when a target weight is reached after removing excess weight. A&D Weighing SJ Washdown Scales are NSF 169 and NSF 1415-1 listed, achieving the highest hygienic food safety standards. NTEP approved for use in legal-for-trade applications.",NSF 169 and NSF 14159-1 listed,"NTEP approved, NTEP CC:18-131",IP67 rated construction,Completely waterproof for easy cleaning,Battery operated with 5000-hour continuous life,Large LCD display with backlight,5 step LED light comparator system,Take-away check weighing,Automatic Power Off prolongs battery life,Data storage for up to 10 comparator limit settings,,Weighing,https://www.scalesplus.com/content/A%26D/Bench%20Scales/SJWP_Brochure.pdf,,2 year manufacturer's warranty,15 kg,0.5 g,2 g,±5 g,232 x 192 mm,67,"Gram, Kilogram, Pound,Ounce, Troy Ounce, Pound Ounce, Tale, Tola, Newtown",Backlit LCD,236 x 260 x 148 mm / 9.3 x 10.2 x 5.8 in,6 D Alkaline batteries,-10° to 40°C / 14° to 104°F,A&D Weighing,SJ-15KWP,https://www.scalesplus.com/a-d-weighing-sj-15kwp-washdown-bench-scale-nsf-ntep/,,,,,,,,,,,,Yes,III,,,,,,,,,,,,Counting,Checkweighing,±50ppm/°C (5° to 35°C / 41° to 104°F),NSF 169 and NSF 14159-1 listed,,,,,,,,,,,,,,,,,,,,,,,,,,,,,,,,,,,,,,,,,,,,,,,,,,,,,,,,,,,,,,,,,,,,,,,,,,,,,,,,,,,,,,,,,,,,,,,,,,,,,,,,,,,,,,,,,,,,,,,,,,,,,,,,,,,,,,,,,,,,,,,,,,,,,,,,,,,,,,,,,,,,,,,,,,,,,,,,,,,,,,,,,,,,,,,,,,,,,,,,,,,,,,,,,,,,,,,,,,,,,,,,,,,,,,,,,,,,,,,,,,,,,,,,,,,,,,,,,,,,,,,,,,,,,,,,
"OHAUS Valor 4000 V41XWE1501T Stainless Steel Food Scale, 3 lb x 0.0005 lb, NTEP",https://cdn11.bigcommerce.com/s-errhy7umuu/images/stencil/1280x1280/products/517/49195/ohaus-valor-4000-v41xwe1501t-stainless-steel-food-scale-3-lb-x-.0005-lb-ntep-class-iii__08563.1727120808.jpg?c=2,https://cdn11.bigcommerce.com/s-errhy7umuu/images/stencil/1280x1280/products/517/48509/ohaus-valor-4000-v41xwe1501t-stainless-steel-food-scale-3-lb-x-.0005-lb-ntep-class-iii__10074.1727120809.jpg?c=2,$770.00,$478.15,$291.85,None,"NIST Traceable Calibration, $129.00","ISO 17025:2017 Accredited Calibration, $199.00","The OHAUS Valor 4000 food scale operates in the most demanding dry or washdown environments commonly encountered in the food industry.  NTEP Legal for Trade certifications, USDA-AMS accepted, and an NSF certified food-safe washdown design makes the OHAUS Valor 4000 a perfect fit for many challenging commercial applications. Your investment is protected thanks to the polycarbonate keypad on the Valor 4000 that prevents damage from knives and other sharp instruments. Enhance your teams productivity with the OHAUS Valor 4000 and its touchless sensors, half second stabilization time, large dual displays, and additional checkweighing and percent weighing modes. Enjoy ultimate portability with a power pack that provides 50 hours of continuous use.",NTEP Legal for Trade certified,NTEP CC: 13-056,Meets or exceeds the NIST Handbook 44 Class III accuracy requirements,Meets or exceeds the Measurement Canada Weights and Measures Regulations,USDA-AMS accepted,Supports HACCP certified systems,Full stainless steel housing,Large dual displays,Knife proof keypad,Flow-thru washdown design ,Touchless infrared sensors for taring,,,,1 year manufacturer's warranty,3 lb,0.0005 lb,,,,,,"7 segment, 6 digit, 20.5 mm / 0.8 in high red LED dual display",,"12V DC 0.84A, AC Universal adapter (100 - 220V AC / 50 -60Hz) and built-in internal rechargeable lead acid battery included",,OHAUS,V41XWE1501T,https://www.scalesplus.com/ohaus-valor-4000-v41xwe1501t-stainless-steel-food-scale-ntep/,https://cdn11.bigcommerce.com/s-errhy7umuu/images/stencil/1280x1280/products/517/49782/ohaus-valor-4000-v41xwe1501t-stainless-steel-food-scale-3-lb-x-.0005-lb-ntep-class-iii__38974.1727120811.jpg?c=2,https://cdn11.bigcommerce.com/s-errhy7umuu/images/stencil/1280x1280/products/517/49432/ohaus-valor-4000-v41xwe1501t-stainless-steel-food-scale-3-lb-x-.0005-lb-ntep-class-iii__57531.1727120812.jpg?c=2,https://cdn11.bigcommerce.com/s-errhy7umuu/images/stencil/1280x1280/products/517/48521/ohaus-valor-4000-v41xwe1501t-stainless-steel-food-scale-3-lb-x-.0005-lb-ntep-class-iii__71865.1727120813.jpg?c=2,Less than half a second stabilization time,Compact design,Leveling bubble,Carrying handle,Weighing,Percent weighing,Check weighing,,Yes,III,,,,190 x 242 mm / 7.5 x 9.5 in,"g, kg, lb, oz","stainless steel platform, Stainless steel housing",,,,,,,,,,,,,,,256 x 280 x 121 mm / 10.1 x 11 x 4.8 in,Typically 50 hours of continuous use with 12-hour full charge,,,,,,,,,,,,,Mechanical keys,Removable stainless steel platform,Spring-loaded power connector cover,,,Accumulation,,,,,,,,,,,,,,,,,,,,,,,,,,,,,,,,,,,,,,,,,"NTEP certified, Measurement Canada approved",,,,Non-slip leveling feet,Ideal as a food portioning scale,Rechargeable battery,50 hour continuous use battery life,"Metrology: NIST Handbook 44 (NTEP CC 13-056), Canada Weights and Measures Regulations (AM-5906C) – Class III, nmax 3000 ",Product Safety: IEC 61010-1:2010; CAN/CSA-C22.2 No. 61010-1-12; UL Std. No. 61010-1 (3rd Edition),Electromagnetic Compatibility: FCC Part 15; Industry Canada ICES-003 – Class B ,Ingress Protection: IEC 60529 Edition 2.1 – IPX8,Food Safety: NSF/ANSI 169-2009; NSF/ANSI /3-A 14159-1-2010,Other: WEEE/RoHS,0.001 lb,,,,,,,,,,,,Easy to clean and transport,,,,,,,,,,,,,,,,,,,,,,,,,,,,,,,,,,,,,,,,,,,,,,,,,,,,,,,,,,,,,,,,,,,,,,,,,,,,,,,,,,,,,,,,,,,,,,,,,,,,,,,,,,,,,,,,,,,,,,,,,,,,,,,,,,,,,,,,,,,,,,,,,,,,,,,,,,,,,,,,,,,,,,,,,,,,,,,,,,,,
"A&D Weighing FS-15KiN Washdown Checkweighing Scale, 35 lb x 0.01 lb, NTEP Class III",https://cdn11.bigcommerce.com/s-errhy7umuu/images/stencil/1280x1280/products/6891/38620/aandd-weighing-fs-15kin-washdown-checkweighing-scale-35-lb-x-0.01-lb-ntep-class-iii__58833.1722024011.jpg?c=2,https://cdn11.bigcommerce.com/s-errhy7umuu/images/stencil/1280x1280/products/6891/38966/aandd-weighing-fs-15kin-washdown-checkweighing-scale-35-lb-x-0.01-lb-ntep-class-iii__09588.1722024013.jpg?c=2,"$1,350.00","$1,020.60",$329.40,None,"NIST Traceable Calibration, $129.00","ISO 17025:2017 Accredited Calibration, $199.00","A&D Weighing FS-i series washdown scales are fully stainless steel and carry an IP65 rating and NSF certification for use in food grade applications. The highly visible red, yellow, and green comparator lights allow for quick and simple checkweighing in any lighting condition. The FS-i series has additional helpful user features such as adjustable feet for leveling, preset tares, and a 100 item memory for recalling frequently weighed items. The N at the end of FS-iN refers to the scale being NTEP approved for use in legal for trade applications. ",IP65 rated dust and waterproof protection,NSF Certified,Stainless steel construction,Column mounted display,"Comparator Function with lights, Red (LO), Green (OK), and Yellow (HI) lights are easy to read under any lighting condition","Annunciators for Stable, Net, Zero, Units, and comparator indications",Adjustable leveling feet,Integrated level bubble ensures proper setup ,Tilting display head with digital keypad,Preset tare,Auto-off function,Weighing,https://www.scalesplus.com/content/A%26D/Bench%20Scales/FS-i%20IM.pdf,https://www.scalesplus.com/content/A%26D/Bench%20Scales/FS-i%20Lit.pdf,2 year manufacturer's limited warranty,35 lb,0.01 lb,,,,IP65,,7 Segment LCD (18.6 mm Height) with Backlight + Analog Sweep Display with Backlight,,AC Main (100V- 240V) or SLA Battery (Option) Battery Life: Approx. 80h,,A&D Weighing,FS-15KiN,https://www.scalesplus.com/a-d-weighing-fs-15kin-washdown-checkweighing-scale-ntep/,https://cdn11.bigcommerce.com/s-errhy7umuu/images/stencil/1280x1280/products/6891/39973/aandd-weighing-fs-15kin-washdown-checkweighing-scale-35-lb-x-0.01-lb-ntep-class-iii__68604.1722024014.jpg?c=2,https://cdn11.bigcommerce.com/s-errhy7umuu/images/stencil/1280x1280/products/6891/39150/aandd-weighing-fs-15kin-washdown-checkweighing-scale-35-lb-x-0.01-lb-ntep-class-iii__86918.1722024016.jpg?c=2,https://cdn11.bigcommerce.com/s-errhy7umuu/images/stencil/1280x1280/products/6891/39958/aandd-weighing-fs-15kin-washdown-checkweighing-scale-35-lb-x-0.01-lb-ntep-class-iii__21602.1722024017.jpg?c=2,Operator key lockout function,100 item memory - target and limit values for frequently weighed items can easily be stored and recalled,"HI/LO Limit, Target, and Full Range modes are ideal for filling applications",RS-232 Comparator Output Option,,,,https://www.scalesplus.com/content/A%26D/Bench%20Scales/07-104.pdf,Yes,III,07-104,,,"9.8"" x 9.8""","g, kg, lb, oz, and lb-oz",Fully stainless steel,"External, with user-selectable calibration weight","-10°C to 40°C / 14°F to 104°F, 85%RH or lower (No condensation)",optional RS232 Relay,10 times per second,18 lbs,Check-weighing,,,,,,,,,,,,,,,,,,,,,,,,,,,,,,,,,,,,,,,,www.youtube.com/embed/p8zh18S23qM,,,,,AM-5764,,,,,,,,,,,,,,,,,,,,,,,,,,,,,,,,,,,,,,,,,,,,,,,,,,,,,,,,,,,,,,,,,,,,,,,,,,,,,,,,,,,,,,,,,,,,,,,,,,,,,,,,,,,,,,,,,,,,,,,,,,,,,,,,,,,,,,,,,,,,,,,,,,,,,,,,,,,,,,,,,,,,,,,,,,,,,,,,,,,,,,,,,,,,,,,,,,,,,,,,,,,,,,,,,,,,,,,,,,,,,,,,,,,,,,
"OHAUS Defender 6000 i-D61PW12K1R6 Washdown Bench Scale, 25 lb x 0.002 lb, 12"" x 12"", NTEP",https://cdn11.bigcommerce.com/s-errhy7umuu/images/stencil/1280x1280/products/11940/29814/ohaus-i-d61pw12k1r6-defender-6000-extreme-washdown-bench-scale-12-x-12-25-lb-x-0.002-lb-nsf-ntep-class-iii__10543.1724097976.jpg?c=2,https://cdn11.bigcommerce.com/s-errhy7umuu/images/stencil/1280x1280/products/11940/30152/ohaus-i-d61pw12k1r6-defender-6000-extreme-washdown-bench-scale-12-x-12-25-lb-x-0.002-lb-nsf-ntep-class-iii__44739.1724097978.jpg?c=2,"$2,195.00","$1,975.50",$219.50,None,"NIST Traceable Calibration, $129.00","ISO 17025:2017 Accredited Calibration, $199.00","The Ohaus i-D61PW12K1R6 extreme washdown bench scale is specially designed for the harshest of environments. It is an ideal solution for industries such as food, chemical, and pharmaceutical production, processing, and packaging. The polycarbonate indicator carries an IP68 immersion/IP69K washdown protection rating, a knife-proof numeric touch keypad to ensure the integrity of the buttons, and up to 1,600 hours of battery life. Additionally, the stainless steel construction of the weighing pan, load cell, and column provide increased durability and enable easy cleaning.",316 stainless steel hermetically-sealed load cell,316 stainless steel base,Designed for use in the most extremely demanding washdown applications,NTEP and Measurement Canada approved Class III/IIIL,"Up to 75,000 displayed resolution","Up to 1,600 hours of continuous operation with backlight off, one set of batteries allows months of use",Tool free access to the battery compartment,Durable polycarbonate design,Knife-proof numeric touch keypad,"Colored checkweighing LED, with red, green, and yellow lights",Menu password protection,,https://store-errhy7umuu.mybigcommerce.com/content/Ohaus%20Manuals/Defender%206000/Defender_6000_Scale_Datasheet_US_80776640_A.pdf,https://store-errhy7umuu.mybigcommerce.com/content/Ohaus%20Manuals/Defender%206000/Defender_6000_Indicator_Datasheet_US_80776620_A.pdf,1 year manufacturer's warranty,25 lb,0.002 lb,,± 2 divisions,,IP68/IP69K,,,,6 x D type batteries,,OHAUS,i-D61PW12K1R6,https://www.scalesplus.com/ohaus-defender-6000-i-d61pw12k1r6-washdown-bench-scale-ntep/,https://cdn11.bigcommerce.com/s-errhy7umuu/images/stencil/1280x1280/products/11940/31046/ohaus-i-d61pw12k1r6-defender-6000-extreme-washdown-bench-scale-12-x-12-25-lb-x-0.002-lb-nsf-ntep-class-iii__74093.1724097979.jpg?c=2,https://cdn11.bigcommerce.com/s-errhy7umuu/images/stencil/1280x1280/products/11940/36383/ohaus-i-d61pw12k1r6-defender-6000-extreme-washdown-bench-scale-12-x-12-25-lb-x-0.002-lb-nsf-ntep-class-iii__71401.1724097983.jpg?c=2,https://cdn11.bigcommerce.com/s-errhy7umuu/images/stencil/1280x1280/products/11940/31242/ohaus-i-d61pw12k1r6-defender-6000-extreme-washdown-bench-scale-12-x-12-25-lb-x-0.002-lb-nsf-ntep-class-iii__58487.1724097985.jpg?c=2,Key lock,Customizable environment and auto print settings,GMP/GLP output with time/date,Auto shutoff,Weighing,Parts Counting,Checkweighing,https://store-errhy7umuu.mybigcommerce.com/content/Ohaus%20Manuals/Defender%206000/Service%20Manual%20Defender%206000%20indicator_EN%2030655625A.pdf,Yes,,,,,,"Kilogram, Gram, Pound, Ounce, Pound: Ounce",,,,,,,,,,,,,,,,,,,,,,,,,,,,,The i-D61PW12K1R6 carries a large variety of approvals and compliance ratings. (listed below) The most significant of these being the NTEP approval and the ANSI/NSF food safety approval.,Auto tare,Overload/underload indicators,Stability indicator,No communication included standard,Optional IR data communication kit,Check Counting,Dynamic weighing/Display hold,Percentage Weighing,"NTEP Approved CC 20-043, CC 20-064, Class III/IIIL",Measurement Canada approved AM-6159,Food Safety ANSI/NSF 169,Ingress Protection IP68 and IP69K,Product Safety CAN/CSA C22.2 61010-1; UL61010-1; IEC/EN 61010-1,"CAS, CE","WEE, RoHS",USDA-AMS Accepted,https://store-errhy7umuu.mybigcommerce.com/content/Ohaus%20Manuals/Defender%206000/Instruction_Defender_6000_Indicator_EN_ES_FR_DE_IT_30572892_A%20%284%29.pdf,www.youtube.com/embed/vCRuFCzYwB4,0.005 lb,20-043,20-064,"lll, IIIL","Yes, AM-6159 Class lll, lllHD",ANSI/NSF 169,"1:75,000","1:10,000","1,000,000 counts","6-digit, 7-segment LCD display with white backlight, 1.8"" high digits","3 color (red, green, yellow)",6 function mechanical keys,1.5 seconds or less,+/-2% or +/-100% of capacity,None,Infrared (IR) communication kit,14°F to 104°F / -10°C to 40°C,"Up to 1,600 hours of continuous operation with backlight off, time varies with backlight on","11.8"" x 11.8"" x 4.2""","10.2""",24.7 lb,,,,,,,,,,https://cdn11.bigcommerce.com/s-errhy7umuu/images/stencil/1280x1280/products/11940/30246/ohaus-i-d61pw12k1r6-defender-6000-extreme-washdown-bench-scale-12-x-12-25-lb-x-0.002-lb-nsf-ntep-class-iii__98889.1724097986.jpg?c=2,https://cdn11.bigcommerce.com/s-errhy7umuu/images/stencil/1280x1280/products/11940/29805/ohaus-i-d61pw12k1r6-defender-6000-extreme-washdown-bench-scale-12-x-12-25-lb-x-0.002-lb-nsf-ntep-class-iii__18143.1724097987.jpg?c=2,,,,,,,,,,,,,,,,,,,,,https://cdn11.bigcommerce.com/s-errhy7umuu/images/stencil/1280x1280/products/11940/30373/ohaus-i-d61pw12k1r6-defender-6000-extreme-washdown-bench-scale-12-x-12-25-lb-x-0.002-lb-nsf-ntep-class-iii__73651.1724097989.jpg?c=2,,,,,,,,,,,,,,https://cdn11.bigcommerce.com/s-errhy7umuu/images/stencil/1280x1280/products/11940/31241/ohaus-i-d61pw12k1r6-defender-6000-extreme-washdown-bench-scale-12-x-12-25-lb-x-0.002-lb-nsf-ntep-class-iii__60001.1724097991.jpg?c=2,https://cdn11.bigcommerce.com/s-errhy7umuu/images/stencil/1280x1280/products/11940/30310/ohaus-i-d61pw12k1r6-defender-6000-extreme-washdown-bench-scale-12-x-12-25-lb-x-0.002-lb-nsf-ntep-class-iii__66772.1724097981.jpg?c=2,,,,,,,,,,,,,,,,,,,,,,,,,,,,,,,,,,,,,,,,,,,,,,,,,,,,,,,,,,,,,,,,,,,,,,,,,,,,,,,,,,,,,,,,,,,,,,,,,,,,,,,,,,,,,,,,,,,,,,,,,,,,,,,,,,,,,,,,,,,,,,,,,,,,,,,,,,,,,,,,,,,,,,,
"OHAUS Valor 4000 V41PWE3T Water Resistant Food Scale, 6 lb x 0.001 lb, NTEP",https://cdn11.bigcommerce.com/s-errhy7umuu/images/stencil/1280x1280/products/514/48541/ohaus-valor-4000-v41pwe3t-water-resistant-food-scale-6-lb-x-.001-lb-ntep-class-iii__86300.1727115533.jpg?c=2,https://cdn11.bigcommerce.com/s-errhy7umuu/images/stencil/1280x1280/products/514/49064/ohaus-valor-4000-v41pwe3t-water-resistant-food-scale-6-lb-x-.001-lb-ntep-class-iii__47534.1727115535.jpg?c=2,$655.00,$431.50,$223.50,None,"NIST Traceable Calibration, $129.00","ISO 17025:2017 Accredited Calibration, $199.00","The OHAUS Valor 4000 food scale operates in the most demanding dry or washdown environments commonly encountered in the food industry.  NTEP Legal for Trade certifications, USDA-AMS accepted, and an NSF certified food-safe washdown design makes the OHAUS Valor 4000 a perfect fit for many challenging commercial applications. Your investment is protected thanks to the polycarbonate keypad on the Valor 4000 that prevents damage from knives and other sharp instruments. Enhance your teams productivity with the OHAUS Valor 4000 and its touchless sensors, half second stabilization time, large dual displays, and additional checkweighing and percent weighing modes. Enjoy ultimate portability with a power pack that provides 50 hours of continuous use.",NTEP Legal for Trade certified,NTEP CC: 13-056,Meets or exceeds the NIST Handbook 44 Class III accuracy requirements,Meets or exceeds the Measurement Canada Weights and Measures Regulations,USDA-AMS accepted,Supports HACCP certified systems,Large dual displays,Knife proof keypad,Flow-thru washdown design ,Touchless infrared sensors for taring,Less than half a second stabilization time,,,,1 year manufacturer's warranty,6 lb,0.001 lb,,,,,,"7 segment, 6 digit, 20.5 mm / 0.8 in high red LED dual display",,"12V DC 0.84A, AC Universal adapter (100 - 220V AC / 50 -60Hz) and built-in internal rechargeable lead acid battery included",,OHAUS,V41PWE3T,https://www.scalesplus.com/ohaus-valor-4000-v41pwe3t-water-resistant-food-scale-ntep/,https://cdn11.bigcommerce.com/s-errhy7umuu/images/stencil/1280x1280/products/514/48483/ohaus-valor-4000-v41pwe3t-water-resistant-food-scale-6-lb-x-.001-lb-ntep-class-iii__60462.1727115535.jpg?c=2,https://cdn11.bigcommerce.com/s-errhy7umuu/images/stencil/1280x1280/products/514/48674/ohaus-valor-4000-v41pwe3t-water-resistant-food-scale-6-lb-x-.001-lb-ntep-class-iii__91982.1727115537.jpg?c=2,https://cdn11.bigcommerce.com/s-errhy7umuu/images/stencil/1280x1280/products/514/47801/ohaus-valor-4000-v41pwe3t-water-resistant-food-scale-6-lb-x-.001-lb-ntep-class-iii__04646.1727115539.jpg?c=2,Compact design,Leveling bubble,Carrying handle,Mechanical keys,Weighing,Percent weighing,Check weighing,,Yes,III,,,,190 x 242 mm / 7.5 x 9.5 in,"g, kg, lb, oz","stainless steel platform, ABS housing",,,,,,,,,,,,,,,256 x 280 x 121 mm / 10.1 x 11 x 4.8 in,Typically 50 hours of continuous use with 12-hour full charge,,,,,,,,,,,,,Removable stainless steel platform,Spring-loaded power connector cover,Non-slip leveling feet,,,Accumulation,,,,,,,,,,,,,,,,,,,,,,,,,,,,,,,,,,,,,,,,,"NTEP certified, Measurement Canada approved",,https://cdn11.bigcommerce.com/s-errhy7umuu/images/stencil/1280x1280/products/514/48046/ohaus-valor-4000-v41pwe3t-water-resistant-food-scale-6-lb-x-.001-lb-ntep-class-iii__26156.1727115540.jpg?c=2,https://cdn11.bigcommerce.com/s-errhy7umuu/images/stencil/1280x1280/products/514/47406/ohaus-valor-4000-v41pwe3t-water-resistant-food-scale-6-lb-x-.001-lb-ntep-class-iii__92777.1727115541.jpg?c=2,Ideal as a food portioning scale,Rechargeable battery,50 hour continuous use battery life,Easy to clean and transport,"Metrology: NIST Handbook 44 (NTEP CC 13-056), Canada Weights and Measures Regulations (AM-5906C) – Class III, nmax 3000 ",Product Safety: IEC 61010-1:2010; CAN/CSA-C22.2 No. 61010-1-12; UL Std. No. 61010-1 (3rd Edition),Electromagnetic Compatibility: FCC Part 15; Industry Canada ICES-003 – Class B ,Ingress Protection: IEC 60529 Edition 2.1 – IPX8,Food Safety: NSF/ANSI 169-2009; NSF/ANSI /3-A 14159-1-2010,Other: WEEE/RoHS,0.002 lb,,,,,,,,,,,,,,,,,,,,,,,,,,,,,,,,,,,,,,,,,,,,,,,,,,,,,,,,,,,,,,,,,,,,,,,,,,,,,,,,,,,,,,,,,,,,,,,,,,,,,,,,,,,,,,,,,,,,,,,,,,,,,,,,,,,,,,,,,,,,,,,,,,,,,,,,,,,,,,,,,,,,,,,,,,,,,,,,,,,,,,,,,,,,,,,,
"OHAUS Defender 6000 i-D61PW150K1L7 Washdown Bench Scale, 300 lb x 0.02 lb, 20"" x 16"", NTEP",https://cdn11.bigcommerce.com/s-errhy7umuu/images/stencil/1280x1280/products/11944/34267/ohaus-i-d61pw150k1l7-defender-6000-extreme-washdown-bench-scale-20-x-16-300-lb-x-0.02-lb-nsf-ntep-class-iii__77577.1724101215.jpg?c=2,https://cdn11.bigcommerce.com/s-errhy7umuu/images/stencil/1280x1280/products/11944/30516/ohaus-i-d61pw150k1l7-defender-6000-extreme-washdown-bench-scale-20-x-16-300-lb-x-0.02-lb-nsf-ntep-class-iii__38128.1724101217.jpg?c=2,"$2,815.00","$2,533.50",$281.50,None,"NIST Traceable Calibration, $129.00","ISO 17025:2017 Accredited Calibration, $199.00","The Ohaus i-D61PW150K1L7 extreme washdown bench scale is specially designed for the harshest of environments. It is an ideal solution for industries such as food, chemical, and pharmaceutical production, processing, and packaging. The polycarbonate indicator carries an IP68 immersion/IP69K washdown protection rating, a knife-proof numeric touch keypad to ensure the integrity of the buttons, and up to 1,600 hours of battery life. Additionally, the stainless steel construction of the weighing pan, load cell, and column provide increased durability and enable easy cleaning.",316 stainless steel hermetically-sealed load cell,316 stainless steel base,Designed for use in the most extremely demanding washdown applications,NTEP and Measurement Canada approved Class III/IIIL,"Up to 75,000 displayed resolution","Up to 1,600 hours of continuous operation with backlight off, one set of batteries allows months of use",Tool free access to the battery compartment,Durable polycarbonate design,Knife-proof numeric touch keypad,"Colored checkweighing LED, with red, green, and yellow lights",Menu password protection,,https://store-errhy7umuu.mybigcommerce.com/content/Ohaus%20Manuals/Defender%206000/Defender_6000_Scale_Datasheet_US_80776640_A.pdf,https://store-errhy7umuu.mybigcommerce.com/content/Ohaus%20Manuals/Defender%206000/Defender_6000_Indicator_Datasheet_US_80776620_A.pdf,1 year manufacturer's warranty,300 lb,0.02 lb,,± 2 divisions,,IP68/IP69K,,,,6 x D type batteries,,OHAUS,i-D61PW150K1L7,https://www.scalesplus.com/ohaus-defender-6000-i-d61pw150k1l7-washdown-bench-scale-ntep/,https://cdn11.bigcommerce.com/s-errhy7umuu/images/stencil/1280x1280/products/11944/31369/ohaus-i-d61pw150k1l7-defender-6000-extreme-washdown-bench-scale-20-x-16-300-lb-x-0.02-lb-nsf-ntep-class-iii__10618.1724101219.jpg?c=2,https://cdn11.bigcommerce.com/s-errhy7umuu/images/stencil/1280x1280/products/11944/29895/ohaus-i-d61pw150k1l7-defender-6000-extreme-washdown-bench-scale-20-x-16-300-lb-x-0.02-lb-nsf-ntep-class-iii__36465.1724101220.jpg?c=2,https://cdn11.bigcommerce.com/s-errhy7umuu/images/stencil/1280x1280/products/11944/29990/ohaus-i-d61pw150k1l7-defender-6000-extreme-washdown-bench-scale-20-x-16-300-lb-x-0.02-lb-nsf-ntep-class-iii__41642.1724101222.jpg?c=2,Key lock,Customizable environment and auto print settings,GMP/GLP output with time/date,Auto shutoff,Weighing,Parts Counting,Checkweighing,https://store-errhy7umuu.mybigcommerce.com/content/Ohaus%20Manuals/Defender%206000/Service%20Manual%20Defender%206000%20indicator_EN%2030655625A.pdf,Yes,,,,,,"Kilogram, Gram, Pound, Ounce, Pound: Ounce",,,,,,,,,,,,,,,,,,,,,,,,,,,,,The i-D61PW150K1L7 carries a large variety of approvals and compliance ratings. (listed below) The most significant of these being the NTEP approval and the ANSI/NSF food safety approval.,Auto tare,Overload/underload indicators,Stability indicator,No communication included standard,Optional IR data communication kit,Check Counting,Dynamic weighing/Display hold,Percentage Weighing,"NTEP Approved CC 20-043, CC 20-064, Class III/IIIL",Measurement Canada approved AM-6159,Food Safety ANSI/NSF 169,Ingress Protection IP68 and IP69K,Product Safety CAN/CSA C22.2 61010-1; UL61010-1; IEC/EN 61010-1,"CAS, CE","WEE, RoHS",USDA-AMS Accepted,https://store-errhy7umuu.mybigcommerce.com/content/Ohaus%20Manuals/Defender%206000/Instruction_Defender_6000_Indicator_EN_ES_FR_DE_IT_30572892_A%20%284%29.pdf,,0.1 lb,20-043,20-064,"lll, IIIL","Yes, AM-6159 Class lll, lllHD",ANSI/NSF 169,"1:75,000","1:10,000","1,000,000 counts","6-digit, 7-segment LCD display with white backlight, 1.8"" high digits","3 color (red, green, yellow)",6 function mechanical keys,1.5 seconds or less,+/-2% or +/-100% of capacity,None,Infrared (IR) communication kit,14°F to 104°F / -10°C to 40°C,"Up to 1,600 hours of continuous operation with backlight off, time varies with backlight on","19.7"" x 15.7"" x 5.4""","26.4""",50.1 lb,,,,,,,,,,https://cdn11.bigcommerce.com/s-errhy7umuu/images/stencil/1280x1280/products/11944/30601/ohaus-i-d61pw150k1l7-defender-6000-extreme-washdown-bench-scale-20-x-16-300-lb-x-0.02-lb-nsf-ntep-class-iii__12171.1724101223.jpg?c=2,https://cdn11.bigcommerce.com/s-errhy7umuu/images/stencil/1280x1280/products/11944/31213/ohaus-i-d61pw150k1l7-defender-6000-extreme-washdown-bench-scale-20-x-16-300-lb-x-0.02-lb-nsf-ntep-class-iii__49721.1724101224.jpg?c=2,,,,,,,,,,,,,,,,,,,,,,,,,,,,,,,,,,,,,,,,,,,,,,,,,,,,,,,,,,,,,,,,,,,,,,,,,,,,,,,,,,,,,,,,,,,,,,,,,,,,,,,,,,,,,,,,,,,,,,,,,,,,,,,,,,,,,,,,,,,,,,,,,,,,,,,,,,,,,,,,,,,,,,,,,,,,,,,,,,,,,,,,,,,,,,,,,,,,,,,,,,,
