title,image 1,image 2,msrp,price,saving,calibration optional 1,calibration optional 2,calibration optional 3,Description paragraph 1,Description Features point 1,Description Features point 2,Description Features point 3,Description Features point 4,Description Features point 5,Description Features point 6,Description Features point 7,Description Features point 8,Description Features point 9,Description Features point 10,Description Features point 11,Description Applications  point 1,Description document link 1,Description document link 2,warranty information,Specification Capacity,Specification Readability,Specification Repeatability,Specification Linearity,Specification Weighing Pan Dimensions,Specification IP Rating,Specification Measure Units,Specification Display Type,Specification Overall Dimensions,Specification Power,Specification Operating Temperature,Specification Brand,Specification Model,URL,image 3,image 4,image 5,Description Features point 12,Description Features point 13,Description Features point 14,Description Features point 15,Description Applications point 1,Description Applications point 2,Description Applications point 3,Description document link 3,Specification NTEP,Specification Class,Specification NTEP CC,Specification Measurement Canada Approval,Specification Maximum Counts,Specification Pan Size,Specification Weighing Units,Specification Construction,Specification Calibration,Specification Operating Temp,Specification Communication,Specification Display Update,Specification Weight of scale,Description Applications  point 2,Description Applications  point 3,Specification Sensitivity Drift,Specification NSF,Specification CC,Specification NTEP Approved Division,Specification Food Safety,Specification Compliance,Specification Product Safety,Specification Base Dimensions,Specification Battery Operation,Description Features  point 1,Description Features  point 2,Description Features  point 3,Description Features  point 4,Description Features  point 5,Description Features  point 6,Description Features  point 7,Description Features  point 8,Description Features  point 9,Description Features  point 10,Description Features  point 11,Description paragraph 2,Description Features point 16,Description Features point 17,Description Features point 18,Description Communication point 1,Description Communication point 2,Description Applications point 4,Description Applications point 5,Description Applications point 6,Description Compliance point 1,Description Compliance point 2,Description Compliance point 3,Description Compliance point 4,Description Compliance point 5,Description Compliance point 6,Description Compliance point 7,Description Compliance point 8,Description document link 4,Product video 1,Specification Approved Readability,Specification NTEP CC Indicator,Specification NTEP CC Base,Specification NTEP Class,Specification Measurement Canada Approved,Specification Food Safety Approvals,Specification Maximum Displayed Resolution,Specification Maximum Approved Resolution,Specification Internal Resolution,Specification Display,Specification Checkweighing Indicators,Specification Controls,Specification Typical Stabilization Time,Specification Zeroing Range,Specification Communication Included,Specification Optional Communication,Specification Operating Temperature Range,Specification Battery Life Expectancy,Specification Dimensions,Specification Column Height,Specification Weight,Description Weighing Applications point 1,Description Weighing Applications point 2,Specification Stabilization Time,Specification Power Supply,Specification Battery Life,Specification Protection Rating,Specification Electrical Safety,Specification Approvals,Specification Display Height,image 6,image 7,Description Features point 19,Description Features point 20,Description Features point 21,Description Features point 22,Description Approvals point 1,Description Approvals point 2,Description Approvals point 3,Description Approvals point 4,Description Approvals point 5,Description Approvals point 6,Specification Certified Readability (e),Specification Indicator NTEP CC,Specification Base NTEP CC,Specification Max Displayed Resolution,Specification Max Counting Resolution,Specification Overload Capacity,Specification Keyboard,Specification Key Zeroing Range,Specification Interface,Specification Other power options (not included),image 8,Description paragraph 3,Description Features point 23,Description Features point 24,Description Applications point 7,Description document link 5,Description document link 6,Description document link 7,Description document link 8,Specification Certified Readability,Specification Safe Overload,Specification Linearity/Repeatability,Specification Indicator Dimensions (including bracket),Specification Platform Dimension (WxD),image 9,image 10,Description Features point 25,Description Features point 26,Description Features point 27,Description Features point 28,Description Features point 29,Description Features point 30,Description Features point 31,Description Features point 32,Description Features point 33,Specification Certified Weighing Units,Specification Front Display Type,Specification Rear Display Type,Specification Zero Range,Specification Tare Range,Specification Safe Overload Capacity,description heading,Description Approvals point 7,Description Approvals point 8,Description Approvals point 9,Description Approvals point 10,Description Approvals point 11,Description Approvals point 12,Specification Indicator NTEP  CC,Specification Scale NTEP CC,Specification System Linearity,Specification Keys on Display,Specification Status Annunciators,Specification Sample Rate,Specification Digital I/O,Specification NEMA Type,Specification Certified Operating Temperature Range,Specification Power Consumtion,Specification Circuit Protection,Specification Indicator Dimensions,Specification Platform Dimensions,Specification Part Number,Description CW90B Base Features point 1,Description CW90B Base Features point 2,Description CW90B Base Features point 3,Description CW90B Base Features point 4,Description CW90B Base Features point 5,Description CW90B Base Features point 6,Description 380 Indicator Features point 1,Description 380 Indicator Features point 2,Description 380 Indicator Features point 3,Description 380 Indicator Features point 4,Description 380 Indicator Features point 5,Description 380 Indicator Features point 6,Description 380 Indicator Features point 7,Description 380 Indicator Features point 8,Description 380 Indicator Features point 9,Description 380 Indicator Features point 10,Specification Base IP Rating,Specification Indicator IP Rating,Specification Keypad,Specification Serial Communications,Specification Units,Specification Excitation Voltage,Specification Compensated Temperature Range,Description CW90B Base Featuresy point 1,Description CW90B Base Featuresy point 2,Description CW90B Base Featuresy point 3,Description CW90B Base Featuresy point 4,Description CW90B Base Featuresy point 5,Description CW90B Base Featuresy point 6,Specification Scale base NTEP CC,Description 480 Legend Indicator Features point 1,Description 480 Legend Indicator Features point 2,Description 480 Legend Indicator Features point 3,Description 480 Legend Indicator Features point 4,Description 480 Legend Indicator Features point 5,Description 480 Legend Indicator Features point 6,Description 480 Legend Indicator Features point 7,Description 480 Legend Indicator Features point 8,Description 480 Legend Indicator Features point 9,Description 480 Legend Indicator Features point 10,Description 480 Legend Indicator Features point 11,Description 480 Legend Indicator Features point 12,Description 480 Legend Indicator Features point 13,Description Indicator Approvals point 1,Description Indicator Approvals point 2,Description Indicator Approvals point 3,Description Indicator Approvals point 4,Description Indicator Approvals point 5,Description Indicator Approvals point 6,Description Indicator Approvals point 7,Description Indicator Approvals point 8,Specification A/D Sample Rate,Specification Standard Communication,Specification RS-232 baud rates,Specification RS-232 bits,Specification RS-232 Parity,Specification Weight (Approximate),Description 480 Legend Plus Indicator Features point 1,Description 480 Legend Plus Indicator Features point 2,Description 480 Legend Plus Indicator Features point 3,Description 480 Legend Plus Indicator Features point 4,Description 480 Legend Plus Indicator Features point 5,Description 480 Legend Plus Indicator Features point 6,Description 480 Legend Plus Indicator Features point 7,Description 480 Legend Plus Indicator Features point 8,Description 480 Legend Plus Indicator Features point 9,Description 480 Legend Plus Indicator Features point 10,Description 480 Legend Plus Indicator Features point 11,Description 480 Legend Plus Indicator Features point 12,Description 480 Legend Plus Indicator Features point 13,Description 680 Indicator Features point 1,Description 680 Indicator Features point 2,Description 680 Indicator Features point 3,Description 680 Indicator Features point 4,Description 680 Indicator Features point 5,Description 680 Indicator Features point 6,Description 680 Indicator Features point 7,Description 680 Indicator Features point 8,Description 680 Indicator Features point 9,Description 680 Indicator Features point 10,Description 482 Legend Indicator Features point 1,Description 482 Legend Indicator Features point 2,Description 482 Legend Indicator Features point 3,Description 482 Legend Indicator Features point 4,Description 482 Legend Indicator Features point 5,Description 482 Legend Indicator Features point 6,Description 482 Legend Indicator Features point 7,Description 482 Legend Indicator Features point 8,Description 482 Legend Indicator Features point 9,Description 482 Legend Indicator Features point 10,Description 482 Legend Indicator Features point 11,Description 482 Legend Indicator Features point 12,Description 482 Legend Indicator Features point 13,Description 482 Legend Plus Indicator Features point 1,Description 482 Legend Plus Indicator Features point 2,Description 482 Legend Plus Indicator Features point 3,Description 482 Legend Plus Indicator Features point 4,Description 482 Legend Plus Indicator Features point 5,Description 482 Legend Plus Indicator Features point 6,Description 482 Legend Plus Indicator Features point 7,Description 482 Legend Plus Indicator Features point 8,Description 482 Legend Plus Indicator Features point 9,Description 482 Legend Plus Indicator Features point 10,Description 482 Legend Plus Indicator Features point 11,Description 482 Legend Plus Indicator Features point 12,Description 482 Legend Plus Indicator Features point 13,Description CW90XB Base Features point 1,Description CW90XB Base Features point 2,Description CW90XB Base Features point 3,Description CW90XB Base Features point 4,Description CW90XB Base Features point 5,Description CW90XB Base Features point 6,Specification Load Cell Seal Type,Description CW90B Base Features point 7,Description Weighing Applications point 3,Specification Display Resolution,Description RL1200 Base Features point 1,Description RL1200 Base Features point 2,Description RL1200 Base Features point 3,Description 380 Synergy Series Features point 1,Description 380 Synergy Series Features point 2,Description 380 Synergy Series Features point 3,Description 380 Synergy Series Features point 4,Description 380 Synergy Series Features point 5,Description 380 Synergy Series Features point 6,Description 380 Synergy Series Features point 7,Description 380 Synergy Series Features point 8,Description 380 Synergy Series Features point 9,Specification Base Construction,Specification Enclosure Construction,Specification Top Platter Dimensions
"A&D Weighing HL-3000LWP Portable Washdown Balance, 3000 g x 1 g",https://cdn11.bigcommerce.com/s-errhy7umuu/images/stencil/1280x1280/products/7008/39288/aandd-weighing-hl-3000lwp-portable-washdown-balance-3000-g-x-1-g__85120.1722270390.jpg?c=2,https://cdn11.bigcommerce.com/s-errhy7umuu/images/stencil/1280x1280/products/7008/39187/aandd-weighing-hl-3000lwp-portable-washdown-balance-3000-g-x-1-g__02146.1722270388.jpg?c=2,$480.00,$324.00,$156.00,None,"NIST Traceable Calibration, $129.00","ISO 17025:2017 Accredited Calibration, $199.00",The A&D HL-WP series is fully stainless steel and features an IP67 rating. This means that it is completely dust and can be used in any food grade applications. The HL can be used with six AA batteries or with an Adapter. (both not included) The simplicity of the balance allows for an operator to use the scale with little to no training.,Stainless steel construction,"Larger weighing pan 6.8"" x 5.4""",IP67 rated NEMA-4X',NSF listed,Small footprint,Completely waterproof for easy cleaning ,Portable ,Stability indicator,Tare function,Auto power off,Powered by 6 AA batteries or an Adapter (both not included),Weighing,https://www.scalesplus.com/content/A%26D/Portable/HL-WP%20Lit.pdf,https://www.scalesplus.com/content/A%26D/Portable/HL-WP.pdf,2 year manufacturer's limited warranty,3000 g,1 g,1 g,±1 g,"6.8"" x 5.4""",IP67,"grams, oz, lb, lb;o",Clear LCD display,236 x 260 x 148 mm / 9.3 x 10.2 x 5.8 in,6 AA batteries or AC adapter (both not included),-10°C - 40°C (35°C for NTEP) / 14°F - 104°F (95% for NTEP) RH less than 85%,A&D Weighing,HL-3000LWP,https://www.scalesplus.com/a-d-weighing-hl-3000lwp-portable-washdown-balance/,,,,,,,,,,,,,,,,,,,,,,,,,,,,,,,,,,,,,,,,,,,,,,,,,,,,,,,,,,,,,,,,,,,,,,,,,,,,,,,,,,,,,,,,,,,,,,,,,,,,,,,,,,,,,,,,,,,,,,,,,,,,,,,,,,,,,,,,,,,,,,,,,,,,,,,,,,,,,,,,,,,,,,,,,,,,,,,,,,,,,,,,,,,,,,,,,,,,,,,,,,,,,,,,,,,,,,,,,,,,,,,,,,,,,,,,,,,,,,,,,,,,,,,,,,,,,,,,,,,,,,,,,,,,,,,,,,,,,,,,,,,,,,,,,,,,,,,,,,,,
"A&D Weighing HL-300WP Portable Washdown Balance, 300 g x 0.1 g",https://cdn11.bigcommerce.com/s-errhy7umuu/images/stencil/1280x1280/products/7004/39354/aandd-weighing-hl-300wp-portable-washdown-balance-300-g-x-0.1-g__23909.1722270093.jpg?c=2,https://cdn11.bigcommerce.com/s-errhy7umuu/images/stencil/1280x1280/products/7004/40007/aandd-weighing-hl-300wp-portable-washdown-balance-300-g-x-0.1-g__68366.1722270096.jpg?c=2,$490.00,$330.75,$159.25,None,"NIST Traceable Calibration, $129.00","ISO 17025:2017 Accredited Calibration, $199.00",The A&D HL-WP series is fully stainless steel and features an IP67 rating. This means that it is completely dust and can be used in any food grade applications. The HL can be used with six AA batteries or with an Adapter. (both not included) The simplicity of the balance allows for an operator to use the scale with little to no training.,Stainless steel construction,IP67 rated NEMA-4X,NSF listed,Small footprint,Completely waterproof for easy cleaning ,Portable ,Stability indicator,Tare function,Auto power off,Powered by 6 AA batteries or an Adapter (both not included),,Weighing,https://www.scalesplus.com/content/A%26D/Portable/HL-WP%20Lit.pdf,https://www.scalesplus.com/content/A%26D/Portable/HL-WP.pdf,2 year manufacturer's limited warranty,300 g,0.1 g,0.1 g,±0.1 g,"128 mm x 128 mm / 5"" x 5""",IP67,"grams, oz",Clear LCD display,236 x 260 x 148 mm / 9.3 x 10.2 x 5.8 in,6 AAA batteries or AC adapter (both not included),-10°C - 40°C (35°C for NTEP) / 14°F - 104°F (95% for NTEP) RH less than 85%,A&D Weighing,HL-300WP,https://www.scalesplus.com/a-d-weighing-hl-300wp-portable-washdown-balance/,,,,,,,,,,,,,,,,,,,,,,,,,,,,,,,,,,,,,,,,,,,,,,,,,,,,,,,,,,,,,,,,,,,,,,,,,,,,,,,,,,,,,,,,,,,,,,,,,,,,,,,,,,,,,,,,,,,,,,,,,,,,,,,,,,,,,,,,,,,,,,,,,,,,,,,,,,,,,,,,,,,,,,,,,,,,,,,,,,,,,,,,,,,,,,,,,,,,,,,,,,,,,,,,,,,,,,,,,,,,,,,,,,,,,,,,,,,,,,,,,,,,,,,,,,,,,,,,,,,,,,,,,,,,,,,,,,,,,,,,,,,,,,,,,,,,,,,,,,,,
"A&D Weighing SC-30KAM Washdown Checkweighing Scale, 66 lb x 0.01 lb, NTEP Class III",https://cdn11.bigcommerce.com/s-errhy7umuu/images/stencil/1280x1280/products/6930/39570/aandd-weighing-sc-30kam-stainless-steel-washdown-checkweighing-scale-66-lb-x-0.01-lb-ntep-class-iii__47011.1722273399.jpg?c=2,https://cdn11.bigcommerce.com/s-errhy7umuu/images/stencil/1280x1280/products/6930/39381/aandd-weighing-sc-30kam-stainless-steel-washdown-checkweighing-scale-66-lb-x-0.01-lb-ntep-class-iii__76499.1722273401.jpg?c=2,"$1,690.00","$1,277.64",$412.36,None,"NIST Traceable Calibration, $129.00","ISO 17025:2017 Accredited Calibration, $199.00","A&D Weighing SC series features an IP68 rating which makes it ideal for weighing in washdown areas. This series is capable of performing general weighing, checkweighing, and counting. The SC is great for high speed checkweighing due to its one second stabilization time. It also only operates on 6 D batteries on which it has an estimated operation time of around 4500 hours. The SC also features a fully stainless steel base, platform, and column along with a corrosion resistant epoxy coated load cell.",IP68 rated dust and waterproof protection,High-speed weighing in one second to increase your weighing efficiency,"Large, liquid crystal display (LCD) shows all important information at a glance even in dimly lit areas",Large 1.54 inch character size,"Easily changeable units between kg, lbs, oz, and pcs",Long battery life of 4500+ hours with 6 D batteries (only operated by batteries),Robust stainless steel platform and frame,Epoxy-coated load cell prevent corrosion and are reliable in the harshest of environments,Column mounted display,"Annunciators for Stable, Net, Zero, Units, and comparator indications",Adjustable leveling feet,,https://www.scalesplus.comhttps://www.scalesplus.com/content/A%26D/Bench%20Scales/SC-SE%20IM_0.pdf,https://www.scalesplus.com/content/A%26D/Bench%20Scales/SC_SE%20Lit_0.pdf,2 year manufacturer's warranty,66 lb,0.01 lb,,,,IP68,,7 Segment LCD with 39 mm height,"11.8"" x 21.4"" x 28.2""",6 D Batteries,,A&D Weighing,SC-30KAM,https://www.scalesplus.com/a-d-weighing-sc-30kam-washdown-checkweighing-scale/,https://cdn11.bigcommerce.com/s-errhy7umuu/images/stencil/1280x1280/products/6930/39688/aandd-weighing-sc-30kam-stainless-steel-washdown-checkweighing-scale-66-lb-x-0.01-lb-ntep-class-iii__18028.1722273402.jpg?c=2,https://cdn11.bigcommerce.com/s-errhy7umuu/images/stencil/1280x1280/products/6930/38324/aandd-weighing-sc-30kam-stainless-steel-washdown-checkweighing-scale-66-lb-x-0.01-lb-ntep-class-iii__65176.1722273404.jpg?c=2,https://cdn11.bigcommerce.com/s-errhy7umuu/images/stencil/1280x1280/products/6930/39975/aandd-weighing-sc-30kam-stainless-steel-washdown-checkweighing-scale-66-lb-x-0.01-lb-ntep-class-iii__61046.1722273406.jpg?c=2,Integrated level bubble ensures proper setup ,Tilting display head with digital keypad,Preset tare,Multiple connectivity capabilities via Quick USB or RS-232C as options,Weighing,Check-weighing,Counting,https://www.scalesplus.com/content/A%26D/Bench%20Scales/11-048.pdf,Yes,III,11-048,AM-5827,"60,000 pcs","11.8"" x 15""","g, kg, lb, oz, and lb-oz",Stainless steel,"External, with user-selectable calibration weight","-10°C to 40°C / 14°F to 104°F, 85%RH or lower (No condensation)",optional RS232 or USB Relay,10 times per second,27 lbs,,,,,,,,,,,,,,,,,,,,,,,,,,,,,,,,,,,,,,,,,,,,,,,,,,,,,,,,,,,,,,,,,,,,,,,,,,,,,,,,,,,,,,,,,,,,,,,,,,,,,,,,,,,,,,,,,,,,,,,,,,,,,,,,,,,,,,,,,,,,,,,,,,,,,,,,,,,,,,,,,,,,,,,,,,,,,,,,,,,,,,,,,,,,,,,,,,,,,,,,,,,,,,,,,,,,,,,,,,,,,,,,,,,,,,,,,,,,,,,,,,,,,,,,,,,,,,,,,,,,,,,,,,,,,,,,,,,,
"A&D Weighing SK-1000WP Portable Scale, 2.2 lb x 0.001 lb, NTEP Class III",https://cdn11.bigcommerce.com/s-errhy7umuu/images/stencil/1280x1280/products/7015/39765/aandd-weighing-sk-1000wp-portable-scale-2.2-lb-x-0.001-lb-ntep-class-iii__22860.1722268554.jpg?c=2,https://cdn11.bigcommerce.com/s-errhy7umuu/images/stencil/1280x1280/products/7015/38841/aandd-weighing-sk-1000wp-portable-scale-2.2-lb-x-0.001-lb-ntep-class-iii__46349.1722268551.jpg?c=2,$496.00,$334.80,$161.20,None,"NIST Traceable Calibration, $129.00","ISO 17025:2017 Accredited Calibration, $199.00",The A&D SK-WP series is an affordable option for a high quality portioning scale. It is NSF listed and IP65 rated for easy and safe cleaning. The battery operation allows for portable use and has an estimated run time of 1200 plus hours. A temperature compensated load cell allows for operation near ovens and refrigerators. The SK-WP balance is NTEP approved for operation in legal for trade applications.,Temperature compensated load cell for use near ovens or in refrigerated areas,Stainless steel construction,IP65 rated,Small footprint allows for use in even the tightest of spaces,Easy two button operation and intuitive menu,NSF listed,Curved pan design allows for weights to be taken without the need for an extra container,One touch calibration ,Portable ,Auto power off,Powered by 6 D batteries or an Adapter (both not included),Weighing,https://www.scalesplus.com/content/A%26D/Portable/SK-WP%20Lit.pdf,https://www.scalesplus.com/content/A%26D/Portable/SK-WP%20IM.pdf,2 year manufacturer's limited warranty,2.2 lb,0.001 lb,,±1 g,"9.1"" x 7.5"" / 232 mm x 192 mm",IP65,"g, oz, and lb",LCD display,"5.75"" x 10.5"" x 11""",6 D batteries or TB:662 AC Adapter (both not included),-10°C - 40°C (35°C for NTEP) / 14°F - 104°F (95% for NTEP) RH less than 85%,A&D Weighing,SK-1000WP,https://www.scalesplus.com/a-d-weighing-sk-1000wp-portable-scale/,https://cdn11.bigcommerce.com/s-errhy7umuu/images/stencil/1280x1280/products/7015/39148/aandd-weighing-sk-1000wp-portable-scale-2.2-lb-x-0.001-lb-ntep-class-iii__17544.1722268550.jpg?c=2,,,Battery life of 1200+ hours,,,,,,,https://www.scalesplus.com/content/A%26D/Portable/98-086A3.pdf,Yes,III,98-086A2,AM-5270-1,,,,,,,,,,,,,,,,,,,,,,,,,,,,,,,,,,,,,,,,,,,,,,,,,,,,,,,,,,,,,,,,,,,,,,,,,,,,,,,,,,,,,,,,,,,,,,,,,,,,,,,,,,,,,,,,,,,,,,,,,,,,,,,,,,,,,,,,,,,,,,,,,,,,,,,,,,,,,,,,,,,,,,,,,,,,,,,,,,,,,,,,,,,,,,,,,,,,,,,,,,,,,,,,,,,,,,,,,,,,,,,,,,,,,,,,,,,,,,,,,,,,,,,,,,,,,,,,,,,,,,,,,,,,,,,,,,,,,,,,,,,,,
"A&D Weighing SW-6KS Washdown Scale, 13 lb x 0.001 lb, NTEP Class III",https://cdn11.bigcommerce.com/s-errhy7umuu/images/stencil/1280x1280/products/6955/39410/aandd-weighing-sw-6ks-high-pressure-washdown-scale-13-lb-x-0.001-lb-ntep-class-iii__56775.1722279665.jpg?c=2,https://cdn11.bigcommerce.com/s-errhy7umuu/images/stencil/1280x1280/products/6955/38913/aandd-weighing-sw-6ks-high-pressure-washdown-scale-13-lb-x-0.001-lb-ntep-class-iii__71579.1722279667.jpg?c=2,"$2,080.00","$1,572.48",$507.52,None,"NIST Traceable Calibration, $129.00","ISO 17025:2017 Accredited Calibration, $199.00","The A&D SW series features a rugged stainless steel construction as well as an IP69K rating, making it ideal for industrial food processing applications. Fast stabilization times, down to 1 second, and a built-in comparator increase weighing productivity, while a large, bright LED screen clearly displays data, even in dimly lit areas. The stainless steel weighing pan and body are washdown safe for easy cleaning and protection of the inner components. ",Hermetically sealed,IP69K rated construction,Large LED display with backlight,Stainless steel body and weighing pan,Four leveling feet,Comparator with tri-color LED lights,Automatically powers off to extend battery life,ABS indicator,Adjustable indicator,,,Weighing,https://www.scalesplus.com/content/A%26D/Bench%20Scales/SW%20Lit.pdf,https://www.scalesplus.com/content/NTEP%20Certs/11-078.pdf,2 year manufacturer's warranty,13 lb,0.001 lb,0.002 lb,±0.005 lb,250 x 250mm,IP69K,,LED,250 x 480 x 353.5 mm,AC adapter,"-10° to 40°C, Less than 85% R.H.",A&D Weighing,SW-6KS,https://www.scalesplus.com/a-d-weighing-sw-6ks-washdown-scale-ntep/,https://cdn11.bigcommerce.com/s-errhy7umuu/images/stencil/1280x1280/products/6955/39427/aandd-weighing-sw-6ks-high-pressure-washdown-scale-13-lb-x-0.001-lb-ntep-class-iii__28957.1722279668.jpg?c=2,,,,,,,,,,,Yes,III,11-078,,,,,,,,,,,Counting,Checkweighing,±20ppm/°C (5° to 35°C),,,,,,,,,,,,,,,,,,,,,,,,,,,,,,,,,,,,,,,,,,,,,,,,,,,,,,,,,,,,,,,,,,,,,,,,,,,,,,,,,,,,,,,,,,,,,,,,,,,,,,,,,,,,,,,,,,,,,,,,,,,,,,,,,,,,,,,,,,,,,,,,,,,,,,,,,,,,,,,,,,,,,,,,,,,,,,,,,,,,,,,,,,,,,,,,,,,,,,,,,,,,,,,,,,,,,,,,,,,,,,,,,,,,,,,,,,,,,,,,,,,,,,,,,,,,,,,,,,,,,,,,,,,,,,,,,
