"Rice Lake Ready-n-Weigh CW-90B-482-50 Bench Scale, 12"" x 12"", 50 lb x 0.01 lb, NTEP Class III",https://cdn11.bigcommerce.com/s-errhy7umuu/images/stencil/1280x1280/products/13709/52260/rice-lake-weighing-systems-rice-lake-ready-n-weigh-bench-scale-cw-90b-482-50-12-x-12-50-lb-x-0.01-lb-ntep-class-iii__10088.1701107417.jpg?c=2,https://cdn11.bigcommerce.com/s-errhy7umuu/images/stencil/1280x1280/products/13709/52307/rice-lake-weighing-systems-rice-lake-ready-n-weigh-bench-scale-cw-90b-482-50-12-x-12-50-lb-x-0.01-lb-ntep-class-iii__38515.1701107417.jpg?c=2,"$1,870.00","$1,777.00",$93.00,None,"NIST Traceable Calibration, $129.00","ISO 17025:2017 Accredited Calibration, $199.00","This Rice Lake Ready-n-Weigh Bench Scale System features the CW-90B Scale Base and 482 Indicator. The CW-90B Scale Base boasts exceptional durability and a five point overload protection, ensuring reliable and precise measurements in even the most challenging environments. Coupled with the 482 Indicator, this system offers a user-friendly interface, intuitive controls, and provides highly visible readings with a large LCD display. The CW-90B-482 is equipped with a variety of communication options and expansive capabilities through accessory boards. The Rice Lake CW-90B-482 is also NTEP and Measurement Canada approved for use in legal for trade applications. Backed with an IP67 rated base and an IP66 rated indicator, the unit is an excellent solution for use in medium washdown and outdoor environments.",,,,,,,,,,,,,https://store-errhy7umuu.mybigcommerce.com/content/Rice%20Lake%20Manuals/Bench%20Scales/2023_cw90b_482.pdf,https://store-errhy7umuu.mybigcommerce.com/content/Rice%20Lake%20Manuals/Bench%20Scales/m_165124_482_legend_technical_manual_enus_revd.pdf,2 year manufacturer's limited warranty,50 lb,0.01 lb,,,"12"" x 12""",,,"LCD backlit display, transmissive/transflective 0.8 in (20 mm), six-digit, seven-segment",,115 VAC 50/60 Hz,,Rice Lake,CW-90B-482-50,https://www.scalesplus.com/rice-lake-ready-n-weigh-cw-90b-482-50-bench-scale-12-x-12/,https://cdn11.bigcommerce.com/s-errhy7umuu/images/stencil/1280x1280/products/13709/52246/rice-lake-weighing-systems-rice-lake-ready-n-weigh-bench-scale-cw-90b-482-50-12-x-12-50-lb-x-0.01-lb-ntep-class-iii__60744.1701107417.jpg?c=2,,,,,,,General Weighing,Batching / Setpoints (only possible with appropriate accessories) ,Accumulation Weighing,,Yes,III,,,,,"kg, g, lb, oz, tn,  t",304 stainless steel,,,,,,,,,,,,,,,,,,,,,,,,,,,,,,,,,,,,,,,,,,,,,,,,,,,,,,,,,,,,,,,,,,,,,,,,,,,,,,,,,,,,,,,,,,12-123A1,95-072,,,,,,,,,,,,,,,,,,,,,,,,,,,,,,,,,,,,,,,,,,,,,,,,Within 0.01 % of full scale,"power, menu, zero, tare, gross/net, unit, print","Gross, net, center of zero, stand still, lb, kg, tare, preset tare",,,4X,,,,,,,"12"" x 12"" base",IP67 rated load cell,304 stainless steel construction,Five point overload protection with up to 180% to 200% overload rating,Four adjusted rubber feet for leveling,NTEP Class III CC# 95-072,,,,,,,,,,,IP67,IP66,,,,,,,,,,,,,,,,,,,,,,,,,,"NTEP CC 12-123 Accuracy Class III/IIIL, 10,000d",Measurement Canada AM-5892,"Accuracy Class III/IIIHD,10,000d","OIML R76/2006-NL1-12.48,",EU Test Certificate TC8322,"Accuracy Class III, 10,000d",CE Marked,UL/cUL Listed,"5, 10, 20, 40Hz, software selectable","Port 1 - RS-232, Port 2 - RS-232 or 20 mA","1200, 2400, 4800, 9600,19200, 38400",7 or 8,"even, odd, or none",27 lb,,,,,,,,,,,,,,,,,,,,,,,,"NEMA Type 4X/IP66, heavy-gauge stainless steel",7 button keypad,"Two independent serial ports, RS-232 and 20mA","LCD green backlit display, transmissive/transflective 0.8 in (20 mm), six-digit, seven-segment",PreVent breather vent,"Programmable printer ticket formats can perform gross, net, accumulator and setpoints",Configurable with Revolution software,Five built in options for continuous stream formats,"Operator functions through menu for audit trail, preset tare, unit ID, accumulator, time and date, setpoints, communications and print formats",8 configurable setpoints with sequenced batch engine,Adaptive filter or rolling average filter,"Additional option cards available (analog output 0-10 VDC 4-20Ma), (relay output card 2 digital inputs 4 dry contact relays), (USB and Ethernet TCP/IP) *mounting bracket required for option cards*",Optional rechargeable Lithium Ion battery (not included),,,,,,,,,,,,,,,,,,,,,Measurement Canada approved AM-5082,,,,,,,,,,,,,,,,,
"Rice Lake Ready-n-Weigh CW-90XB-380-10 Bench Scale, 10"" x 10"", 10 lb x 0.002 lb, NTEP Class III",https://cdn11.bigcommerce.com/s-errhy7umuu/images/stencil/1280x1280/products/13732/52523/rice-lake-weighing-systems-rice-lake-ready-n-weigh-bench-scale-cw-90xb-380-10-10-x-10-10-lb-x-0.002-lb-ntep-class-iii__54331.1701107424.jpg?c=2,https://cdn11.bigcommerce.com/s-errhy7umuu/images/stencil/1280x1280/products/13732/52626/rice-lake-weighing-systems-rice-lake-ready-n-weigh-bench-scale-cw-90xb-380-10-10-x-10-10-lb-x-0.002-lb-ntep-class-iii__33622.1701107424.jpg?c=2,"$1,952.00","$1,854.00",$98.00,None,"NIST Traceable Calibration, $129.00","ISO 17025:2017 Accredited Calibration, $199.00","This Rice Lake Ready-n-Weigh Bench Scale features the CW-90XB Scale Base and 380 Indicator. The fully stainless steel CW-90XB base features an IP69K hermitically sealed load cell and extensive overload protection, making it a great option for weighing in the harshest of environments. Coupled with the 380 Indicator, this system offers dependable measurements, an easy-to-read display, and a user-friendly operation. With its convenient battery power, the Rice Lake Ready-n-Weigh CW-90XB-380 also offers a high quality portable weighing solution. The unit is also NTEP approved for use in legal for trade applications.",,,,,,,,,,,,,https://store-errhy7umuu.mybigcommerce.com/content/Rice%20Lake%20Manuals/Bench%20Scales/2023_cw90xb_380.pdf,https://store-errhy7umuu.mybigcommerce.com/content/Rice%20Lake%20Manuals/Indicators/380/2021_cat_indicators_380.pdf,2 year manufacturer's warranty,10 lb,0.002 lb,,,"10"" x 10""",,,"LCD display, six-digits, 1"" tall",,Batteries: 4 Alkaline C-cell (Optional: 115/230VAC to 12VDC adapter),,Rice Lake Weighing Systems,CW-90XB-380-10,https://www.scalesplus.com/rice-lake-ready-n-weigh-cw-90xb-380-10-bench-scale-10-x-10/,https://cdn11.bigcommerce.com/s-errhy7umuu/images/stencil/1280x1280/products/13732/52616/rice-lake-weighing-systems-rice-lake-ready-n-weigh-bench-scale-cw-90xb-380-10-10-x-10-10-lb-x-0.002-lb-ntep-class-iii__79966.1701107424.jpg?c=2,https://cdn11.bigcommerce.com/s-errhy7umuu/images/stencil/1280x1280/products/13732/52544/rice-lake-weighing-systems-rice-lake-ready-n-weigh-bench-scale-cw-90xb-380-10-10-x-10-10-lb-x-0.002-lb-ntep-class-iii__83584.1701107424.jpg?c=2,,,,,,General Weighing,,,https://store-errhy7umuu.mybigcommerce.com/content/Rice%20Lake%20Manuals/Indicators/380/m_201481_380tech_enus_reva.pdf,Yes,III,,,,,,304 stainless steel,,,,,,,,,,,,,,,,,,,,,,,,,,,,,,,,,,,,,,,,,,,,,,,,,,,,,,,,,,,,,,,,,,,,,,,,,,,,,,,,,,,,,,,,,,21-051,95-072,,,,,,,,,,,,,,,,,,,,,,,,,,,,,,,,,,,,,,,,,,,,,,,,±0.01% full scale,,"g, lb, t, tn, kg, oz, battery level, PT, LT, gross, zero, unstable, net",,,,,,,,,,,,,,,,"Battery powered via four C-cell batteries, Optional AC adapter (PN:206433)",Easy installation and removal of batteries through two battery packs accessed through the bottom of the indicator,304 stainless steel enclosure with IP66 rating overall,Simplified 5-button operation,Three wire RS-232 and USB 2.0 communication capable,"LCD display, six 1"" digits",Full front-panel digital calibration,"Capable of printing, Optional Date and Time can be added with module (PN:204258)",Push button and keyed tare,NTEP and Measurement Canada approved,IP69K,IP66,5 membrane tactile keys,RS-232 (3 wire) or USB,"g, lb, t, tn, kg, oz",5 VDC,14°F to 104°F,,,,,,,,,,,,,,,,,,,,,,,,,,,,,,,,,,,,,,,,,,,,,,,,,,,,,,,,,,,,,,,,,,,,,,,,,,,,,,,,,,,,"10"" x 10"" base",IP69K rated hermetically sealed load cell,304 stainless steel construction,Five point overload protection with up to 180% to 200% overload rating,Four adjusted rubber feet for leveling,NTEP and Measurement Canada approved,Hermetically sealed,,,,,,,,,,,,,,,,,,
"Rice Lake Ready-n-Weigh CW-90B-680-5 Bench Scale, 10"" x 10"", 5 lb x 0.001 lb, NTEP Class III",https://cdn11.bigcommerce.com/s-errhy7umuu/images/stencil/1280x1280/products/13717/52273/rice-lake-weighing-systems-rice-lake-ready-n-weigh-bench-scale-cw-90b-680-5-10-x-10-5-lb-x-0.001-lb-ntep-class-iii__82279.1701107421.jpg?c=2,https://cdn11.bigcommerce.com/s-errhy7umuu/images/stencil/1280x1280/products/13717/52283/rice-lake-weighing-systems-rice-lake-ready-n-weigh-bench-scale-cw-90b-680-5-10-x-10-5-lb-x-0.001-lb-ntep-class-iii__37836.1701107421.jpg?c=2,"$1,710.00","$1,625.00",$85.00,None,"NIST Traceable Calibration, $129.00","ISO 17025:2017 Accredited Calibration, $199.00","This Rice Lake Ready-n-Weigh Bench Scale System features the CW-90B Scale Base and the 680 Indicator. The CW-90B Scale Base boasts exceptional durability and a five point overload protection, ensuring reliable and precise measurements in even the most challenging environments. Coupled with the 680 Indicator, this system offers a user-friendly interface, eight LED annunciators, a fully numeric keypad, and provides highly visible readings with a large LED display. The CW-90B-680 is equipped with a variety of onboard communication options and quality assurance approvals. The CW-90B-680 is also NTEP and Measurement Canada approved for use in legal for trade applications. The unit is backed with an IP67 rated base and an IP69K rated indicator for use in washdown environments. ",,,,,,,,,,,,,https://store-errhy7umuu.mybigcommerce.com/content/Rice%20Lake%20Manuals/Bench%20Scales/2023_cw90b_680%20%281%29.pdf,https://store-errhy7umuu.mybigcommerce.com/content/Rice%20Lake%20Manuals/Bench%20Scales/m_us_192627_680_tech_revd.pdf,2 year manufacturer's limited warranty,5 lb,0.001 lb,,,"10"" x 10""",,,"Red LED seven 0.8"" tall, seven-segment digits",,100-240 VAC 50-60 Hz,,Rice Lake,CW-90B-680-5,https://www.scalesplus.com/rice-lake-ready-n-weigh-cw-90b-680-5-bench-scale-10-x-10/,https://cdn11.bigcommerce.com/s-errhy7umuu/images/stencil/1280x1280/products/13717/52323/rice-lake-weighing-systems-rice-lake-ready-n-weigh-bench-scale-cw-90b-680-5-10-x-10-5-lb-x-0.001-lb-ntep-class-iii__10969.1701107421.jpg?c=2,,,,,,,General Weighing,Batching / Setpoints ,Accumulation Weighing,,Yes,III,,,,,"lb, kg, g, oz, tn,  t, none",304 stainless steel,,,"Two RS-232, full duplex RS-485, full duplex USB (device), Ethernet (10/100)",,,,,,,,,,,,,,,,,,,,,,,,,,,,,,,,,,,,,,,,,,,,,,,,,,,,,,,,,,,,,,,,,,,,,,,,,,,,,,,,,,,,,,,19-021,95-072,,,,,,,,,,,,,,,,,,,,,,,,,,,,,,,,,,,,,,,,,,,,,,,,Within 0.01 % of full scale,,,,,,,,,,,,"10"" x 10"" base",IP67 rated load cell,304 stainless steel construction,Five point overload protection with up to 180% to 200% overload rating,Four adjusted rubber feet for leveling,NTEP and Measurement Canada approved,,,,,,,,,,,IP67,IP69K,,,,,,,,,,,,,,,,,,,,,,,,,,"NTEP CC 19-021, Class III/IIIL, 10,000d",Measurement Canada AM-6121C,"Class III/IIIHD, 10,000d",OIML R76/2006-A-NL1-19.56,EU Test Certificate TC11562,UKCA,UL/cUL Listed,CE Marked,"6.25-120 Hz, software selectable",,,,,24 lb,,,,,,,,,,,,,,Stainless steel IP69K enclosure,"Bright 0.8 inch tall seven-digit, seven-segment LED display","Three serial ports: two RS-232, one full duplex RS-485",Ethernet TCP/IP,USB device,"Four onboard configurable digital I/O points, TTL logic",Full numeric keypad that allows for tare and setpoint entry,Battery backed time and date,Formattable tickets,Eight LED status annunciators,,,,,,,,,,,,,,,,,,,,,,,,,,,,,,,,,,,,,,,,,,,,,,,,,,,
"Rice Lake Ready-n-Weigh CW-90B-482-5 Bench Scale, 10"" x 10"", 5 lb x 0.001 lb, NTEP Class III",https://cdn11.bigcommerce.com/s-errhy7umuu/images/stencil/1280x1280/products/13705/52285/rice-lake-weighing-systems-rice-lake-ready-n-weigh-bench-scale-cw-90b-482-5-10-x-10-5-lb-x-0.001-lb-ntep-class-iii__79405.1701107415.jpg?c=2,https://cdn11.bigcommerce.com/s-errhy7umuu/images/stencil/1280x1280/products/13705/52327/rice-lake-weighing-systems-rice-lake-ready-n-weigh-bench-scale-cw-90b-482-5-10-x-10-5-lb-x-0.001-lb-ntep-class-iii__16295.1701107415.jpg?c=2,"$1,780.00","$1,691.00",$89.00,None,"NIST Traceable Calibration, $129.00","ISO 17025:2017 Accredited Calibration, $199.00","This Rice Lake Ready-n-Weigh Bench Scale System features the CW-90B Scale Base and 482 Indicator. The CW-90B Scale Base boasts exceptional durability and a five point overload protection, ensuring reliable and precise measurements in even the most challenging environments. Coupled with the 482 Indicator, this system offers a user-friendly interface, intuitive controls, and provides highly visible readings with a large LCD display. The CW-90B-482 is equipped with a variety of communication options and expansive capabilities through accessory boards. The Rice Lake CW-90B-482 is also NTEP and Measurement Canada approved for use in legal for trade applications. Backed with an IP67 rated base and an IP66 rated indicator, the unit is an excellent solution for use in medium washdown and outdoor environments.",,,,,,,,,,,,,https://store-errhy7umuu.mybigcommerce.com/content/Rice%20Lake%20Manuals/Bench%20Scales/2023_cw90b_482.pdf,https://store-errhy7umuu.mybigcommerce.com/content/Rice%20Lake%20Manuals/Bench%20Scales/m_165124_482_legend_technical_manual_enus_revd.pdf,2 year manufacturer's limited warranty,5 lb,0.001 lb,,,"10"" x 10""",,,"LCD backlit display, transmissive/transflective 0.8 in (20 mm), six-digit, seven-segment",,115 VAC 50/60 Hz,,Rice Lake,CW-90B-482-5,https://www.scalesplus.com/rice-lake-ready-n-weigh-cw-90b-482-5-bench-scale-10-x-10/,https://cdn11.bigcommerce.com/s-errhy7umuu/images/stencil/1280x1280/products/13705/52291/rice-lake-weighing-systems-rice-lake-ready-n-weigh-bench-scale-cw-90b-482-5-10-x-10-5-lb-x-0.001-lb-ntep-class-iii__62826.1701107415.jpg?c=2,,,,,,,General Weighing,Batching / Setpoints (only possible with appropriate accessories) ,Accumulation Weighing,,Yes,III,,,,,"kg, g, lb, oz, tn,  t",304 stainless steel,,,,,,,,,,,,,,,,,,,,,,,,,,,,,,,,,,,,,,,,,,,,,,,,,,,,,,,,,,,,,,,,,,,,,,,,,,,,,,,,,,,,,,,,,,12-123A1,95-072,,,,,,,,,,,,,,,,,,,,,,,,,,,,,,,,,,,,,,,,,,,,,,,,Within 0.01 % of full scale,"power, menu, zero, tare, gross/net, unit, print","Gross, net, center of zero, stand still, lb, kg, tare, preset tare",,,4X,,,,,,,"10"" x 10"" base",IP67 rated load cell,304 stainless steel construction,Five point overload protection with up to 180% to 200% overload rating,Four adjusted rubber feet for leveling,NTEP and Measurement Canada approved,,,,,,,,,,,IP67,IP66,,,,,,,,,,,,,,,,,,,,,,,,,,"NTEP CC 12-123 Accuracy Class III/IIIL, 10,000d",Measurement Canada AM-5892,"Accuracy Class III/IIIHD,10,000d","OIML R76/2006-NL1-12.48,",EU Test Certificate TC8322,"Accuracy Class III, 10,000d",CE Marked,UL/cUL Listed,"5, 10, 20, 40Hz, software selectable","Port 1 - RS-232, Port 2 - RS-232 or 20 mA","1200, 2400, 4800, 9600,19200, 38400",7 or 8,"even, odd, or none",24 lb,,,,,,,,,,,,,,,,,,,,,,,,"NEMA Type 4X/IP66, heavy-gauge stainless steel",7 button keypad,"Two independent serial ports, RS-232 and 20mA","LCD green backlit display, transmissive/transflective 0.8 in (20 mm), six-digit, seven-segment",PreVent breather vent,"Programmable printer ticket formats can perform gross, net, accumulator and setpoints",Configurable with Revolution software,Five built in options for continuous stream formats,"Operator functions through menu for audit trail, preset tare, unit ID, accumulator, time and date, setpoints, communications and print formats",8 configurable setpoints with sequenced batch engine,Adaptive filter or rolling average filter,"Additional option cards available (analog output 0-10 VDC 4-20Ma), (relay output card 2 digital inputs 4 dry contact relays), (USB and Ethernet TCP/IP) *mounting bracket required for option cards*",Optional rechargeable Lithium Ion battery (not included),,,,,,,,,,,,,,,,,,,,,,,,,,,,,,,,,,,,,,
"Rice Lake Ready-n-Weigh CW-90B-680-25 Bench Scale, 12"" x 12"", 25 lb x 0.005 lb, NTEP Class III",https://cdn11.bigcommerce.com/s-errhy7umuu/images/stencil/1280x1280/products/13720/52346/rice-lake-weighing-systems-rice-lake-ready-n-weigh-bench-scale-cw-90b-680-25-12-x-12-25-lb-x-0.005-lb-ntep-class-iii__38987.1701107422.jpg?c=2,https://cdn11.bigcommerce.com/s-errhy7umuu/images/stencil/1280x1280/products/13720/52249/rice-lake-weighing-systems-rice-lake-ready-n-weigh-bench-scale-cw-90b-680-25-12-x-12-25-lb-x-0.005-lb-ntep-class-iii__28940.1701107422.jpg?c=2,"$1,800.00","$1,710.00",$90.00,None,"NIST Traceable Calibration, $129.00","ISO 17025:2017 Accredited Calibration, $199.00","This Rice Lake Ready-n-Weigh Bench Scale System features the CW-90B Scale Base and the 680 Indicator. The CW-90B Scale Base boasts exceptional durability and a five point overload protection, ensuring reliable and precise measurements in even the most challenging environments. Coupled with the 680 Indicator, this system offers a user-friendly interface, eight LED annunciators, a fully numeric keypad, and provides highly visible readings with a large LED display. The CW-90B-680 is equipped with a variety of onboard communication options and quality assurance approvals. The CW-90B-680 is also NTEP and Measurement Canada approved for use in legal for trade applications. The unit is backed with an IP67 rated base and an IP69K rated indicator for use in washdown environments. ",,,,,,,,,,,,,https://store-errhy7umuu.mybigcommerce.com/content/Rice%20Lake%20Manuals/Bench%20Scales/2023_cw90b_680%20%281%29.pdf,https://store-errhy7umuu.mybigcommerce.com/content/Rice%20Lake%20Manuals/Bench%20Scales/m_us_192627_680_tech_revd.pdf,2 year manufacturer's limited warranty,25 lb,0.005 lb,,,"12"" x 12""",,,"Red LED seven 0.8"" tall, seven-segment digits",,100-240 VAC 50-60 Hz,,Rice Lake,CW-90B-680-25,https://www.scalesplus.com/rice-lake-ready-n-weigh-cw-90b-680-25-bench-scale-12-x-12/,https://cdn11.bigcommerce.com/s-errhy7umuu/images/stencil/1280x1280/products/13720/52287/rice-lake-weighing-systems-rice-lake-ready-n-weigh-bench-scale-cw-90b-680-25-12-x-12-25-lb-x-0.005-lb-ntep-class-iii__00746.1701107422.jpg?c=2,,,,,,,General Weighing,Batching / Setpoints ,Accumulation Weighing,,Yes,III,,,,,"lb, kg, g, oz, tn,  t, none",304 stainless steel,,,"Two RS-232, full duplex RS-485, full duplex USB (device), Ethernet (10/100)",,,,,,,,,,,,,,,,,,,,,,,,,,,,,,,,,,,,,,,,,,,,,,,,,,,,,,,,,,,,,,,,,,,,,,,,,,,,,,,,,,,,,,,19-021,95-072,,,,,,,,,,,,,,,,,,,,,,,,,,,,,,,,,,,,,,,,,,,,,,,,Within 0.01 % of full scale,,,,,,,,,,,,"12"" x 12"" base",IP67 rated load cell,304 stainless steel construction,Five point overload protection with up to 180% to 200% overload rating,Four adjusted rubber feet for leveling,NTEP and Measurement Canada approved,,,,,,,,,,,IP67,IP69K,,,,,,,,,,,,,,,,,,,,,,,,,,"NTEP CC 19-021, Class III/IIIL, 10,000d",Measurement Canada AM-6121C,"Class III/IIIHD, 10,000d",OIML R76/2006-A-NL1-19.56,EU Test Certificate TC11562,UKCA,UL/cUL Listed,CE Marked,"6.25-120 Hz, software selectable",,,,,27 lb,,,,,,,,,,,,,,Stainless steel IP69K enclosure,"Bright 0.8 inch tall seven-digit, seven-segment LED display","Three serial ports: two RS-232, one full duplex RS-485",Ethernet TCP/IP,USB device,"Four onboard configurable digital I/O points, TTL logic",Full numeric keypad that allows for tare and setpoint entry,Battery backed time and date,Formattable tickets,Eight LED status annunciators,,,,,,,,,,,,,,,,,,,,,,,,,,,,,,,,,,,,,,,,,,,,,,,,,,,
"Rice Lake Ready-n-Weigh CW-90XB-380-100 Bench Scale, 12"" x 12"", 100 lb x 0.02 lb, NTEP Class III",https://cdn11.bigcommerce.com/s-errhy7umuu/images/stencil/1280x1280/products/13736/52584/rice-lake-weighing-systems-rice-lake-ready-n-weigh-bench-scale-cw-90xb-380-100-12-x-12-100-lb-x-0.02-lb-ntep-class-iii__97231.1701107426.jpg?c=2,https://cdn11.bigcommerce.com/s-errhy7umuu/images/stencil/1280x1280/products/13736/52545/rice-lake-weighing-systems-rice-lake-ready-n-weigh-bench-scale-cw-90xb-380-100-12-x-12-100-lb-x-0.02-lb-ntep-class-iii__02294.1701107426.jpg?c=2,"$2,042.00","$1,940.00",$102.00,None,"NIST Traceable Calibration, $129.00","ISO 17025:2017 Accredited Calibration, $199.00","This Rice Lake Ready-n-Weigh Bench Scale features the CW-90XB Scale Base and 380 Indicator. The fully stainless steel CW-90XB base features an IP69K hermitically sealed load cell and extensive overload protection, making it a great option for weighing in the harshest of environments. Coupled with the 380 Indicator, this system offers dependable measurements, an easy-to-read display, and a user-friendly operation. With its convenient battery power, the Rice Lake Ready-n-Weigh CW-90XB-380 also offers a high quality portable weighing solution. The unit is also NTEP approved for use in legal for trade applications. ",,,,,,,,,,,,,https://store-errhy7umuu.mybigcommerce.com/content/Rice%20Lake%20Manuals/Bench%20Scales/2023_cw90xb_380.pdf,https://store-errhy7umuu.mybigcommerce.com/content/Rice%20Lake%20Manuals/Indicators/380/2021_cat_indicators_380.pdf,2 year manufacturer's warranty,100 lb,0.02 lb,,,"12"" x 12""",,,"LCD display, six-digits, 1"" tall",,Batteries: 4 Alkaline C-cell (Optional: 115/230VAC to 12VDC adapter),,Rice Lake Weighing Systems,CW-90XB-380-100,https://www.scalesplus.com/rice-lake-ready-n-weigh-cw-90xb-380-100-bench-scale-12-x-12/,https://cdn11.bigcommerce.com/s-errhy7umuu/images/stencil/1280x1280/products/13736/52518/rice-lake-weighing-systems-rice-lake-ready-n-weigh-bench-scale-cw-90xb-380-100-12-x-12-100-lb-x-0.02-lb-ntep-class-iii__27773.1701107426.jpg?c=2,https://cdn11.bigcommerce.com/s-errhy7umuu/images/stencil/1280x1280/products/13736/52516/rice-lake-weighing-systems-rice-lake-ready-n-weigh-bench-scale-cw-90xb-380-100-12-x-12-100-lb-x-0.02-lb-ntep-class-iii__50114.1701107426.jpg?c=2,,,,,,General Weighing,,,https://store-errhy7umuu.mybigcommerce.com/content/Rice%20Lake%20Manuals/Indicators/380/m_201481_380tech_enus_reva.pdf,Yes,III,,,,,,304 stainless steel,,,,,,,,,,,,,,,,,,,,,,,,,,,,,,,,,,,,,,,,,,,,,,,,,,,,,,,,,,,,,,,,,,,,,,,,,,,,,,,,,,,,,,,,,,21-051,95-072,,,,,,,,,,,,,,,,,,,,,,,,,,,,,,,,,,,,,,,,,,,,,,,,±0.01% full scale,,"g, lb, t, tn, kg, oz, battery level, PT, LT, gross, zero, unstable, net",,,,,,,,,,,,,,,,"Battery powered via four C-cell batteries, Optional AC adapter (PN:206433)",Easy installation and removal of batteries through two battery packs accessed through the bottom of the indicator,304 stainless steel enclosure with IP66 rating overall,Simplified 5-button operation,Three wire RS-232 and USB 2.0 communication capable,"LCD display, six 1"" digits",Full front-panel digital calibration,"Capable of printing, Optional Date and Time can be added with module (PN:204258)",Push button and keyed tare,NTEP and Measurement Canada approved,IP69K,IP66,5 membrane tactile keys,RS-232 (3 wire) or USB,"g, lb, t, tn, kg, oz",5 VDC,14°F to 104°F,,,,,,,,,,,,,,,,,,,,,,,,,,,,,,,,,,,,,,,,,,,,,,,,,,,,,,,,,,,,,,,,,,,,,,,,,,,,,,,,,,,,"12"" x 12"" base",IP69K rated hermetically sealed load cell,304 stainless steel construction,Five point overload protection with up to 180% to 200% overload rating,Four adjusted rubber feet for leveling,NTEP and Measurement Canada approved,Hermetically sealed,,,,,,,,,,,,,,,,,,
